1,Tamqrah,Shawdforth,133261301,Female,Fachhochschule Bonn-Rhein-Sieg,Schamberger Group,Product Management
2,Ardys,Ferenczi,64744,Female,Chaudhary Charan Singh University,Gutmann, Cummings and Cormier,Accounting
3,Margette,Dibner,62606,Female,University of Sudbury,Doyle, Powlowski and Leuschke,Business Development
4,Libby,Gandrich,593301943,Female,University College Cork,Jenkins Inc,Training
5,Lennard,Castelin,006311003,Male,University of West Hungary,VonRueden-Dooley,Marketing
6,Nicol,Hacard,6706,Male,Open University of Hong Kong,Yundt-Monahan,Human Resources
7,Phil,Abelov,161462057,Non-binary,Payame Noor University,Schaefer, Fahey and Mills,Research and Development
8,Susy,Reuther,764423273,Polygender,Zayed University,Johns Group,Marketing
9,Vania,Klousner,816022270,Female,Ghana Christian University College,Jast, Rogahn and Dicki,Engineering
10,Tedda,Whotton,331665643,Female,State University of Management,Bergstrom-Kautzer,Marketing
11,Francisco,Ettels,287394217,Male,Presbyterian College,O'Hara, Sipes and Lakin,Training
12,Marlie,Patillo,336142630,Female,Omdurman Ahlia University,Shields Inc,Support
13,Travus,Colcutt,462601903,Male,Universidad de Puerto Rico, Carolina,Herman-Skiles,Marketing
14,Lebbie,Delahunty,352708,Female,Al-Nasser University,Wyman, Nikolaus and Considine,Services
15,Peggy,Alexsandrowicz,801123648,Female,American Jewish University,Leannon-Heathcote,Product Management
16,Merline,Keysall,33016,Female,Western Maryland College,Stark, Howe and Steuber,Training
17,Etan,Wellbank,48267,Male,Kuvempu University,Feeney, Erdman and Larson,Training
18,Meade,Yukhnevich,770775865,Male,Ulyanovsk State Technical University,Powlowski-Watsica,Sales
19,Corny,Padilla,973391189,Male,University of Cyprus,Gerhold-Ward,Services
20,Bobbe,Hagstone,926833396,Female,Columbia College of Missouri,Trantow, Kozey and Kertzmann,Services
21,Alyda,Sperring,331733015,Female,Rheinisch Westfälische Technische Hochschule Aachen,Aufderhar Inc,Business Development
22,Jeremiah,Osant,400651660,Male,Mayo Medical School,Greenholt LLC,Product Management
23,Kerry,Medina,440011350,Male,Sapporo Medical University,Braun Group,Services
24,Reade,Josofovitz,B2V,Male,Katholische Fachhochschule Mainz,Schulist Inc,Legal
25,Corene,Glusby,30103,Genderfluid,Wuhan Technical University of Surveying and Mapping,Hand Inc,Legal
26,Ignaz,Kelsow,,Male,University of Zadar,Kilback, Bashirian and Auer,Sales
27,Gae,Rouke,907035438,Female,Rheinische Friedrich-Wilhelms Universität Bonn,Klocko-Gorczany,Support
28,Eugenius,Conibear,631101002,Male,Universidad del Atlántico,Kiehn, Rolfson and Nicolas,Legal
29,Andre,Edgehill,503-0644,Male,International Budo University,Kshlerin, Walker and Wisoky,Accounting
30,Leslie,Brickwood,850122702,Male,National University of Shipbuilding,VonRueden and Sons,Support
31,Valma,Toulch,505015740,Female,Tusculum College,O'Connell, Mitchell and Kozey,Product Management
32,Hammad,Allden,622072326,Male,Aichi Shukutoku University,Macejkovic-Mohr,Marketing
33,Curtice,Coller,30540,Male,University of Neuchatel,Kertzmann, Flatley and Gislason,Human Resources
34,Tiffani,Wetherill,310367297,Female,Fachhochschule Nordhessen,Heaney-Fahey,Services
35,Rhiamon,Molloy,212283703,Female,Reformed Bible College,Swaniawski-Rutherford,Sales
36,Elfrieda,Cotsford,28777,Female,Morris College,Hirthe-Wiza,Training
37,Jamil,Grinyakin,,Male,Universidad Nacional Daniel Alcides Carrion,Runolfsson-Olson,Product Management
38,Amery,Carbett,,Male,Ecole Supérieure d'Ingénieurs en Génie Electrique,Shields, Kiehn and O'Kon,Human Resources
39,Noreen,Gallafant,112203599,Female,Ho Chi Minh City University of Architecture,Dickens, Lueilwitz and Hackett,Legal
40,Tirrell,Joskowitz,982744127,Male,National Sanskrit University,Effertz Inc,Human Resources
41,Mar,Chicotti,770812944,Genderqueer,Universidade Autónoma de Lisboa Luís de Camoes,Stanton, Kertzmann and Blick,Sales
42,Pierce,Long,852488134,Male,El Colegio de México,Schuster-Keebler,Accounting
43,Adelaide,Dommerque,900276062,Female,Holy Apostles College,Greenholt-Kshlerin,Training
44,Alphonse,Atwel,395330555,Male,Universidad de Norteamerica,Conroy-Luettgen,Marketing
45,Boycey,Crawcour,759042707,Male,Moscow Institute of Physics and Technology,Oberbrunner, Blick and Hackett,Product Management
46,Kikelia,Clendinning,658075209,Female,National University of Uzbekistan,Schinner, Johns and Altenwerth,Engineering
47,Atalanta,Newe,456318441,Female,Dr. B.R. Ambedkar Open University,Breitenberg, Turner and Parisian,Training
48,Thorny,Sim,3505,Male,Orenburg State University,Smith Inc,Services
49,Lothaire,Haszard,,Polygender,Technical University of Mining and Metallurgy Ostrava,Gusikowski and Sons,Product Management
50,Baryram,Lis,9507,Male,Gansu University of Technology,Haley LLC,Engineering
51,Arri,Alelsandrowicz,327953457,Male,Kobe Pharmaceutical University,Erdman-Kuhlman,Human Resources
52,Vince,Studman,,Male,Griffith University,Hodkiewicz, Barrows and Collier,Legal
53,Mabelle,O'Hartnett,481686823,Genderfluid,Najran University,Hammes LLC,Accounting
54,Gelya,Delwater,02114,Female,Morgan State University,Goodwin and Sons,Legal
55,Matthieu,Camble,47403,Male,University of California, Merced,Koelpin Inc,Business Development
56,Shelli,Jevons,016052903,Female,California State University, San Bernadino,Russel-Cronin,Human Resources
57,Steffie,Cremer,59604,Polygender,The Emirates Academy of Hotel Managment,Streich, Wilkinson and Cummings,Product Management
58,Melantha,Crookall,850063742,Female,Hebei University of Economics and Trade,Nader-Shanahan,Sales
59,Rosella,Bunton,65600,Female,Universidade Jean Piaget de Cabo Verde,Kilback, Blanda and Jakubowski,Human Resources
60,Mathian,Merigon,895203006,Genderqueer,Universidade Católica de Pernambuco,Tillman and Sons,Research and Development
61,Jory,Lownds,212750001,Male,Royal Danish Academy of Fine Arts, School of Visual Art,Murray, Ratke and Bartoletti,Human Resources
62,Gal,Lage,492036125,Male,Nairobi Technical Training Institute ,Beier-Streich,Services
63,Burl,Fere,891336340,Male,Alabama Agricultural and Mechanical University,Prohaska, Kiehn and Daugherty,Human Resources
64,Sollie,Cheyney,756330549,Male,University Tun Abdul Razak,Graham-Zieme,Accounting
65,Saxe,Petrus,334096501,Male,Samara State Technical University,Runolfsson and Sons,Accounting
66,Laraine,Marrian,,Non-binary,Universidad Tecnológica de El Salvador,Dach-Kunze,Engineering
67,Sandy,Birckmann,664413466,Male,Centro Universitario de Occidente,Price LLC,Support
68,Giff,Belsham,330253925,Male,Nordakademie, Staatlich anerkannte private Fachhochschule mit dualen Studiengängen,Graham and Sons,Product Management
69,Kris,Hinkley,2956,Male,Olivet Nazarene University,Veum Group,Support
70,Leila,Crosetti,330246184,Female,Vidyasagar University,Pfeffer-Parker,Sales
71,Gibbie,Rouzet,753974599,Male,University of Alaska - Anchorage,Strosin, Christiansen and Kuphal,Legal
72,Shane,Trevorrow,55057,Female,Universidad Privada Boliviana,Klein-Trantow,Marketing
73,Dew,Coiley,537052254,Male,State Engineering University of Armenia,Reichel LLC,Services
74,Katuscha,Rubinsaft,53221,Female,Pratt Institute,Hermiston, Mraz and Flatley,Product Management
75,Addy,Toombs,,Male,Universidade Federal de Roraima,Graham-Wisoky,Legal
76,Karoline,Scamadine,795530911,Female,Nanjing University of Traditional Chinese Medicine,Kuphal Inc,Services
77,Edsel,Noden,,Genderqueer,Adams State College,Mayer-Gleason,Services
78,Tallou,Dalbey,105502026,Female,Mokpo National Maritime University,Senger and Sons,Engineering
79,Aurie,Baff,679510010,Agender,Université de Lomé,Collier LLC,Accounting
80,Richie,De Filippis,600482149,Male,Koshien University,Gibson-Wolff,Research and Development
81,Wandie,Adamski,083022123,Non-binary,Al-Islah University,Padberg Group,Marketing
82,Joane,Prene,,Female,Universidad Especializada de Las Americas,Walsh-Marquardt,Training
83,Bernita,Walenta,11375,Female,Moscow State University of Geodesy and Cartography,Schaefer-Franecki,Human Resources
84,Kitty,Markwick,520520550,Genderqueer,Arid Agriculture University,Schmitt-Jerde,Engineering
85,Charmane,Ruffli,271035616,Genderfluid,Bourgas Free University,D'Amore Inc,Services
86,Christy,Wilfinger,170554325,Male,Quincy University,Schumm, Shields and Carroll,Sales
87,Dana,Koopman,945465305,Female,Universitas Widyatama,Shields, Raynor and O'Conner,Support
88,Annis,Chad,,Female,Universidad del Bío-Bío,Hermiston Group,Sales
89,Pamela,Bletsoe,674392541,Female,Université de Skikda,Conn, Wintheiser and Breitenberg,Services
90,Drugi,Rabier,,Male,Universidad Bernardo O'Higgins,Rau-Robel,Marketing
91,Bancroft,Athey,32-854,Male,Ottawa University,Bernier Group,Product Management
92,Danna,Richardin,,Female,International Islamic University, Islamabad,Bailey, Beahan and Feest,Research and Development
93,Alex,Gladwin,,Female,Osaka University of Foreign Studies,Olson Inc,Research and Development
94,Madlin,Breakey,917541746,Genderqueer,University of Macerata,Gorczany Inc,Support
95,Jordana,Jamson,117101308,Female,Music Academy "Ignacy Jana Paderewski" in Poznan,O'Hara Inc,Services
96,Nerissa,Izon,279493990,Female,Kennesaw State University,Stanton, Zboncak and Schoen,Product Management
97,Germaine,Kneebone,210427766,Male,Midland Lutheran College,Kovacek-Johnston,Accounting
98,Averyl,Tofanelli,170330858,Female,Tsuda College,Hyatt, Weissnat and Kuhlman,Sales
99,Lori,Thorneloe,752847229,Genderqueer,Universidad Catolica de La Santísima Concepción,Thiel, Jakubowski and Koepp,Engineering
100,Phil,De Biasio,19034,Male,Shanghai Sanda University,Schmitt-Bernier,Business Development
101,Konstance,Vitte,772691363,Female,Dominican College of Philosophy and Theology,Walter Group,Accounting
102,Leupold,Deluze,06611,Male,National Metallurgical Academy of Ukraine,Gleichner, Sawayn and Witting,Human Resources
103,Marlie,Shyre,129835644,Female,Gulf Medical University,Waelchi and Sons,Services
104,Hersh,Pearle,983906390,Male,DeVry Institute of Technology, Columbus,Jaskolski LLC,Legal
105,Godard,Brogini,061083579,Male,University of Southern Denmark,Wehner, Mayert and Gislason,Services
106,Reine,Inseal,667904,Female,University of North Carolina at Greensboro,Ratke, Feil and Hills,Research and Development
107,Constantine,Station,,Female,University of Wroclaw,Muller, Smith and Bogisich,Support
108,Karee,Cator,891203757,Female,Makanlal Chutur Vedi University,Rutherford, Windler and Conn,Training
109,Michaela,Crother,444842430,Female,Tri-College University,Quigley, Will and Effertz,Sales
110,Arleyne,Peterffy,141707,Female,Dilla University,Roob and Sons,Services
111,Jeno,Scorrer,038940912,Male,Ludwik Solski State Academy of Theatre in Cracow,Mueller-Jakubowski,Human Resources
112,Rafaellle,Kertess,655560777,Polygender,Ryszard Lazarski University of Commerce and Law in Warsaw,Konopelski, Blanda and Schulist,Product Management
113,Torry,Cottom,48427,Male,Universitas Muhammadiyah Mataram,Effertz-Emard,Human Resources
114,Johnath,Shrieves,397601506,Female,Reinhardt College,Larson, D'Amore and Lehner,Training
115,Lacee,Dalliston,207211910,Female,University Institute of Architecture Venice,Murphy, Padberg and Zulauf,Marketing
116,Gabriel,Cholwell,,Male,King Mongkut's University of Technology Ladkrabang,Bahringer, Bashirian and Blanda,Product Management
117,Doroteya,Eshmade,33701,Polygender,Minsk Institute of Management,Carroll, Rempel and Harris,Services
118,Lorne,Dalmon,900742920,Female,University of Mississippi Medical Center,Spencer-Erdman,Marketing
119,Ora,Barrasse,66-220,Female,Andrews University,Rosenbaum and Sons,Sales
120,Teddie,Lantaff,006748513,Male,Kaduna State University,Balistreri-Lemke,Human Resources
121,Christoper,Mc Elory,278356028,Male,Cag University,Ziemann, Conn and Tillman,Business Development
122,Orazio,Simner,171058700,Male,Izhevsk State Technical University,Schowalter, Bartoletti and Kessler,Marketing
123,Urbano,Iliffe,9209,Male,Georg-Simon-Ohm-Fachhochschule Nürnberg,Grimes-Langworth,Services
124,Timothy,Heaps,852593361,Male,Fachhochschule Osnabrück,King-Herzog,Accounting
125,Robb,Deshorts,572622398,Male,University of Hormozgan,Huels-Baumbach,Research and Development
126,Alvy,Stringman,850122702,Male,Universidad Autónoma de Yucatán,Abbott LLC,Engineering
127,Balduin,Scading,191202421,Male,National Institute of the Arts,Jaskolski-Williamson,Research and Development
128,Layne,Camelia,820725140,Female,Cumberland College,Turner Group,Marketing
129,Fons,Jellico,654832130,Male,Beirut Arab University,Kub-Hilpert,Research and Development
130,Petunia,Calverley,553443248,Female,Pomorsk State University,Schamberger-Barrows,Services
131,Margarette,Heiner,211575726,Female,Baltic International Academy,Emard Group,Business Development
132,Clarence,Harmon,479783211,Male,Schiller International University, Paris,Ziemann-Wolff,Accounting
133,Heather,Dinesen,730756613,Female,Morrison College,Ankunding, Altenwerth and Dare,Accounting
134,Wilbur,Keher,,Male,Southern Wesleyan University,Smith, Jacobs and Hettinger,Legal
135,Candy,Brightling,303848886,Female,Wakkanai Hokusei Gakuen University,Tremblay Inc,Support
136,Gare,Larmuth,KKR,Male,Technical University of Warsaw,Windler-Labadie,Research and Development
137,Quincy,Rohlfing,634015210,Male,Amirkabir College of Managmant & Technology,Wiegand-Schinner,Accounting
138,Maria,Bompass,226641127,Female,University of Economics in Bratislava,Wiegand and Sons,Engineering
139,Daisey,Sirkett,712017407,Female,St. Petersburg State Technological University of Plant Polymers,Schroeder, White and Casper,Marketing
140,Adrian,Bolesma,94115,Male,Purdue University North Central,Maggio, Kuhn and O'Conner,Sales
141,Meier,Barth,674102153,Genderqueer,Ecole Nationale Supérieure d'Electronique et de Radioelectricite de Grenoble,D'Amore, Ratke and Graham,Support
142,Denver,Gouck,359601023,Male,Tribhuvan University Kathmandu,Sanford LLC,Research and Development
143,Helge,Kelberer,,Female,Aarhus Technical College,Bahringer Inc,Engineering
144,Colver,Turton,835012431,Male,Newports Institute of Communication & Economics,Schulist, Bernhard and Hettinger,Research and Development
145,Gwen,Rothery,351602217,Female,Al-Wataniya Private University,Stokes, Romaguera and Mayert,Business Development
146,Tobias,Bakeup,680451400,Male,Baylor College of Medicine,Kutch, Lesch and Jacobson,Human Resources
147,Brennan,Benford,112032017,Male,Insituto Universitario - Centro Latinoamericano de Economia Humana - IU Claeh,Renner, Kuhic and Breitenberg,Human Resources
148,Louis,Olivas,374010070,Male,Dohto University,Rodriguez-Collier,Product Management
149,Ted,Moizer,,Male,Universidad José Cecilio del Valle,Veum-Rogahn,Services
150,Langston,Hablet,,Male,Tashkent Islam University,Goldner-Koch,Legal
151,Rebekah,Bennen,841320002,Bigender,Universitas Kristen Indonesia Tomohon,Blick-Fay,Marketing
152,Cori,Held,907014002,Female,Estonian Academy of Music and Theatre,Olson-Crooks,Business Development
153,Vanessa,Howe,620881173,Female,Jishou University,Emmerich-Becker,Legal
154,Maurizia,Burchnall,,Female,Sana'a University,Johns Inc,Training
155,Arabele,Androlli,278356028,Female,Assiut University,Larkin, Feest and Bergstrom,Research and Development
156,Alaster,Angric,606084511,Male,Bourgas Free University,Kshlerin, Maggio and Klein,Training
157,Bridie,Kleinholz,945668300,Female,Acadia University,Romaguera, Rodriguez and Schiller,Business Development
158,Dulci,Samarth,044121005,Female,Oslo School of Architecture,Mante Inc,Training
159,Trish,Freer,752840596,Female,Mahidol University International College,Balistreri, Runolfsdottir and Kilback,Research and Development
160,Bobbie,Drohun,007269707,Female,Gustavus Adolphus College,Kulas, Krajcik and Shanahan,Human Resources
161,Felike,Matthius,5050-345,Male,Erskine College,Kilback-McClure,Business Development
162,Colly,Boldra,463739487,Female,Katholische Fachhochschule Berlin (KFB),Von and Sons,Engineering
163,Meagan,Wickins,191413020,Female,Singhania University Rajasthan,Weimann-Nolan,Human Resources
164,Brandice,Balloch,950651816,Female,Université de Bamako,Doyle-Kreiger,Services
165,Octavius,Francesconi,309055741,Male,Dominican College of Philosophy and Theology,Rempel, Mann and Schneider,Product Management
166,Onfroi,Synder,670032122,Male,Eötvös Lorand University,Reinger, Rosenbaum and Bashirian,Support
167,Ash,Silkstone,64442,Male,University of Education Hradec Kralove,Hodkiewicz and Sons,Services
168,Orton,Haresnape,427171080,Male,Pedagogical University of Bydgoszcz,Leuschke-Waelchi,Training
169,Brenn,Hannaby,711112385,Female,University of Sydney,Bogisich-Hayes,Marketing
170,Lothario,Himsworth,502012902,Male,Universität Leipzig,Walker, Johnston and Kunde,Support
171,Bili,Worthy,122124890,Female,University of Milan - Bicocca,Langworth, Reilly and Greenholt,Services
172,Cathrin,Migheli,739424438,Female,Irkutsk State University,Larson-Pollich,Sales
173,Vergil,Rabat,939303431,Male,University of the West Indies, Mona,Hills, Koss and Cronin,Marketing
174,Smitty,Stonnell,212155216,Male,Institute for Advanced Studies Lucca,King, Bauch and Bogan,Support
175,Chase,Candy,13660-000,Male,Vermont Law School,Morissette-Kassulke,Research and Development
176,Darrel,Winfindale,620026722,Male,University of Juba,Keebler-Tromp,Services
177,Eberto,Falloon,480333849,Polygender,Akhbar El Yom Academy,Hamill, Olson and Wolf,Research and Development
178,Zonda,Milbank,627047450,Female,Evangelische Fachhochschule Reutlingen-Ludwigsburg, Hochschule für Soziale Arbeit, Religionspädagogik und Diakonie,Glover-Swift,Research and Development
179,Nolie,Escalera,75284,Female,Fachhochschule für Verwaltung und Rechtspflege Berlin,O'Conner-Anderson,Human Resources
180,Tiffanie,Schankelborg,485035902,Polygender,Centro Universitário de Araraquara,Swift LLC,Engineering
181,Emelina,Pitchers,807371121,Female,Universidad de Carabobo,Nitzsche-Legros,Engineering
182,Eddy,Crudgington,,Male,Universidade Federal do Rio Grande do Sul,Kuhlman-Jacobi,Product Management
183,Barbe,Cawcutt,370275064,Female,Tyumen State Agricultural Academy,Monahan, Hackett and Wunsch,Engineering
184,Peria,Philippet,370552080,Bigender,College of New Caledonia,Borer Group,Services
185,Callida,Nielson,96818,Female,University of Agriculture and Veterinary Medicine Bucharest,Connelly, Prosacco and Collins,Human Resources
186,Michaela,Kures,053026435,Female,Fukui Prefectural University,Friesen, Dickinson and Aufderhar,Human Resources
187,Rozelle,Cowing,792012320,Female,Santa Clara University,Breitenberg Inc,Training
188,Dell,Rays,4745-530,Female,Tezpur University,Brakus-Murphy,Marketing
189,Aimil,Levane,875442385,Female,Western State University College of Law,Beatty LLC,Product Management
190,Gannie,Dawber,796041198,Genderfluid,Jawzjan University,Rau, Labadie and Wolff,Support
191,Sabra,Daily,2530-692,Female,The Achievers University,Bernier-Wisozk,Business Development
192,Trever,Chuck,707910887,Male,Gollis University,Block Inc,Research and Development
193,Dyann,Gillespie,380757461,Female,Chinhoyi University of Technology,Hahn-Gibson,Marketing
194,Elsworth,Dallmann,521529,Male,Academia Tehnica Militara,Conn LLC,Legal
195,Martguerita,Kleinschmidt,644821528,Female,The College of Wooster,Kshlerin-D'Amore,Marketing
196,Nicolette,Bremner,061171508,Agender,United Business Institute,Stracke Inc,Business Development
197,Dacie,Agney,592302604,Genderfluid,Tomsk Polytechnic University,Jacobson, Crona and Kautzer,Support
198,Darcee,Habens,331733015,Female,Ho Chi Minh City University of Medicine and Pharmacy,McCullough-Friesen,Business Development
199,Barbara-anne,Colisbe,,Female,Gomel State University Francisk Scarnia,Wehner-Beier,Support
200,Frederique,MacLeod,668390289,Female,Dillard University,Leannon-Barton,Marketing
201,Tiffi,Dillingston,,Female,Kochi Medical School,Kuhic, Keeling and Homenick,Legal
202,Bianca,Pennrington,481181383,Female,Yashawantrao Chavan Maharashtra Open University,Jacobson, Wilkinson and Bartell,Product Management
203,Ronald,Meynell,441171714,Male,Jacobs University Bremen,Altenwerth LLC,Marketing
204,Ferguson,McCoid,973831487,Male,Saga University,Schaden-Gerhold,Engineering
205,Conant,Bichard,982393413,Male,Dneprodzerzhinsk State Technical University,Schmidt LLC,Product Management
206,Cori,Rosson,70769,Female,Ambassador University,Douglas-Larkin,Product Management
207,Riccardo,Garrity,480333849,Male,North China University of Technology,Steuber, Kling and Corwin,Legal
208,Timmi,Kobera,543079070,Female,University of Connecticut,Bahringer LLC,Human Resources
209,Grenville,Done,85010,Male,University of Southern Philippines Foundation,Wunsch, Greenfelder and Marquardt,Support
210,Muffin,McDougald,046191329,Male,University of Management and Technology ,Metz and Sons,Sales
211,Nefen,Fretwell,4615-131,Male,Ecole Nationale Vétérinaire de Lyon,Blanda-Ryan,Support
212,Ricki,Gibberd,750250840,Female,University of the Philippines Diliman,Gorczany, Hansen and Heaney,Accounting
213,Paddy,Kunes,,Male,Universidad del Salvador,Wisoky-Deckow,Accounting
214,Aldridge,Stapylton,510411836,Male,Yonok University,Wilderman-Boyle,Product Management
215,Frederico,Children,158010447,Male,Kanda University of International Studies,Little, Kozey and Walter,Accounting
216,Jillane,Mulkerrins,89759,Female,Mary Baldwin College,Connelly Group,Product Management
217,Wiatt,Craythorne,9023,Male,Agricultural University of Poznan,Kub, Jast and Treutel,Research and Development
218,Guenna,Cumbes,333093750,Female,Islamia University of Bahawalpur,Balistreri-Torp,Marketing
219,Aloin,Mattes,088162511,Male,Bethel College Newton,Bahringer-Mann,Sales
220,Audrey,Brunning,82160,Female,Punjab Engineering College Deemed University,Witting-Witting,Accounting
221,Gaynor,Watkiss,296154831,Female,Universidad de Gerona,Olson, Roberts and Bartoletti,Support
222,Melisande,Rive,02104 CEDEX,Female,Universidad Pedagógica Nacional, Unidad León,Berge, Stark and Veum,Product Management
223,Deirdre,Archdeckne,191013703,Female,Merz Akademie, Hochschule für Gestaltung Stuttgart,Reilly LLC,Product Management
224,Sandi,Codman,413 26,Female,Faryab Higher Education Institute,Pollich-Willms,Sales
225,Evaleen,Wiffen,427171080,Female,EVTEK University of Applied Sciences,Barton, Bogisich and Medhurst,Legal
226,Jerome,Drogan,550631913,Male,Kobe City University of ForeignStudies,Mertz LLC,Sales
227,Thatch,Aikman,380635577,Polygender,Mogilev State University A.A. Kuleshov,Crist, Kilback and Durgan,Marketing
228,Alexis,Zorzini,611082381,Female,Kobe Shinwa Women's University,Hammes-Goldner,Business Development
229,Rocky,Giacomoni,750243532,Male,Universitas Mahasaraswati Denpasar,Mueller and Sons,Marketing
230,Alex,Carolan,,Female,Briar Cliff College,Quitzon-Will,Legal
231,Tann,Faill,317941695,Male,Yanbian University of Science and Technology,Schaefer LLC,Human Resources
232,Christie,Camous,104672401,Male,New England School of Law,Treutel Group,Business Development
233,Hanny,Youll,662111922,Female,University of California, Merced,Schimmel, O'Hara and Towne,Product Management
234,Giff,Duplan,667432000,Male,Universitas Islam Syekh-Yusuf ,Effertz, Bergnaum and Lakin,Sales
235,Aksel,Kenan,4207,Agender,Hitotsubashi University,Cassin-Kerluke,Services
236,Curtice,Murphy,754014101,Male,Geneva College,Reilly-Hettinger,Engineering
237,Leontine,Gerdes,325781045,Female,Buddhasravaka Bhikshu University,Block-Reinger,Services
238,Dione,Lauxmann,693362563,Female,Universidad Autónoma Metropolitana - Xochimilco,Hessel-Morar,Support
239,Weston,Brunotti,13253 CEDEX 06,Male,University of Minnesota - Morris,Von, Bosco and Murray,Product Management
240,Irita,Bent,,Female,Tyumen State University,Greenholt, Ziemann and Ward,Marketing
241,Chicky,Nisbith,461312140,Male,Morris Brown College,Graham Group,Sales
242,Derrick,Reavell,,Male,Chonbuk Sanup University of Technology (Howon University),Little, Schinner and Rice,Sales
243,Misti,Dearness,,Genderqueer,Technological Education Institute of Halkida, Euboea,Shanahan LLC,Support
244,Mikey,Fawcus,,Genderfluid,European Business School Schloß Reichartshausen,Hartmann Inc,Research and Development
245,Sheridan,Wayper,2530-407,Male,Universität Lüneburg,Pollich, Dach and Kunze,Support
246,Corena,Daniells,496847475,Female,Botswana College of Agriculture,D'Amore Group,Training
247,Kimmi,Dalrymple,475471028,Female,Hollins University,Schaden-Douglas,Services
248,Brian,Hele,91965 CEDEX,Male,Dohto University,Windler-Little,Sales
249,Ninette,Sambedge,612720,Female,Hormozgan University of Medical Sciences,Hyatt, Lockman and Lynch,Services
250,Esta,Golt,790650000,Female,International Hellenic University,Towne Group,Services
251,Kristo,Georgi,,Male,Central South University,Hauck-Corkery,Services
252,Sloan,Dulwich,776651997,Male,Pak-AIMS (American Institute of Management Sciences),Gerhold and Sons,Engineering
253,Edin,Frotton,984150299,Female,Hanoi University of Science,Muller, Crist and Lang,Marketing
254,Eberto,Lievesley,394283894,Male,Ateneo de Naga University,Gorczany-Ernser,Services
255,Cristal,Gradwell,3220,Female,George Washington University,Olson-Gorczany,Legal
256,Ker,Ivanets,158011440,Male,Seigakuin University,Schmidt, Spinka and Schroeder,Product Management
257,Rollie,Gannicleff,469921914,Male,Indiana University-Purdue University at Columbus,Lebsack and Sons,Training
258,Darcy,Cuddehy,,Female,Academy of Art College,Stoltenberg Group,Training
259,Saleem,Covington,,Male,University of Marketing and Distribution Sciences,Prohaska and Sons,Support
260,Clark,Tanman,993620197,Male,Rasmussen College, Wisconsin Campuses,Gerlach LLC,Sales
261,Bernhard,Lebond,370274536,Male,University of Nebraska - Kearney,Powlowski, Romaguera and Thompson,Support
262,Rhys,Scamp,387014719,Male,West Pomeranian Business School in Szczecin,Bruen and Sons,Legal
263,Lisetta,Upsale,913642573,Female,Arthur D. Little Management Education Institute,Shields-Little,Services
264,Stanislas,O'Moylane,795460491,Male,Deaconess College of Nursing,Heathcote Inc,Legal
265,Latrina,Gillum,452632927,Female,University of Botswana,Mayert-Jakubowski,Product Management
