266,Amble,Tasseler,286212447,Male,Kyushu Sangyo University,Conn, Effertz and Kassulke,Support
267,Elmore,Malatalant,48267,Male,Karpagam University,Cassin and Sons,Training
268,Edvard,Placidi,191826594,Male,Gifu University,Auer Group,Support
269,Lewie,Eldershaw,718018124,Male,Universität Regensburg,Hickle and Sons,Human Resources
270,Genvieve,Ruffle,933064018,Female,Technological University (Sittwe),Champlin-Mills,Product Management
271,Haslett,Hulett,331353904,Male,Sahmyook University,Kreiger-Trantow,Training
272,Jose,Stafford,,Male,Hood College,Steuber Group,Support
273,Phillip,Dissman,104631937,Male,Donetsk National Technical University,Breitenberg-Dicki,Engineering
274,Hedvige,Oolahan,770577353,Female,Kursk State University,Toy-Hoppe,Support
275,Lurette,Chown,,Female,DeVry Institute of Technology, Kansas City,Leffler, Hills and Dietrich,Human Resources
276,Coop,McCrann,544495703,Male,Northern Kentucky University,Swift Group,Product Management
277,Farris,Malim,170330854,Male,Gulu University,Halvorson-Mueller,Sales
278,Trista,Loache,717110797,Female,University of Wisconsin - Madison,Reinger-Rosenbaum,Research and Development
279,Burk,Smittoune,191400096,Male,Heriot-Watt University,Schmidt LLC,Services
280,Waverly,Ferrar,,Male,Sendai University,Howe, Stiedemann and Klocko,Marketing
281,Dniren,Langeren,331854067,Female,Texas A&M University,Bahringer, Beer and Torp,Accounting
282,Cati,Miles,,Bigender,Rutgers, The State University of New Jersey - Newark,Kirlin-Dickinson,Training
283,Patience,Cornils,497831822,Female,Miyagi University of Education,Dare, Graham and Hand,Product Management
284,Quill,Laugharne,656163725,Male,George Wythe College,Pacocha, Luettgen and Parker,Training
285,Timmi,Shoosmith,313134000,Female,Shippensburg University of Pennsylvania,Davis-Cremin,Human Resources
286,Benny,Gosforth,,Male,Universiti Putra Malaysia,Ankunding, Runolfsdottir and Denesik,Legal
287,Alfons,Shilito,282601743,Male,The College of Wooster,Mayer, Harris and Balistreri,Accounting
288,Gigi,Billingsley,,Polygender,Kardan University,Schinner-Kihn,Support
289,Susann,Sone,749552811,Female,Debre Markos University,Blanda, Donnelly and Upton,Marketing
290,Kimmi,Riggoll,837061338,Female,Alice Lloyd College,Larkin, Beatty and Fadel,Services
291,Jeremy,Arenson,752525618,Male,Universidad de Pinar del Río,Ryan-Schuster,Legal
292,Noland,Calbaithe,485035902,Male,California State University, Stanislaus,Cormier LLC,Training
293,Olenka,Gillyett,282600164,Female,Emmaus Bible College,Emmerich-Lynch,Sales
294,Paulette,Marklin,31901,Female,Neumann College,Pacocha-Kessler,Research and Development
295,Andreana,Boud,,Female,University of Wales Institute, Cardiff,Beatty Group,Sales
296,Dallis,Yeatman,928684203,Male,San Juan Bautista School of Medicine,Hand-Dietrich,Marketing
297,Benton,Canfield,20148,Male,Technical University in Zvolen,Tromp Group,Legal
298,Tess,Guilloux,381202177,Female,Institute of Business Administration Sukkur,Langosh-Klocko,Legal
299,Boone,Shercliff,901993,Male,New Jersey City University,Mitchell-Bergstrom,Marketing
300,Deana,Rudram,705051193,Female,Qom University,Huels, Walker and Emmerich,Product Management
301,Harli,Furniss,017424159,Female,Universidad San Sebastian,Blanda-Grady,Product Management
302,Gabriela,Hydes,304390597,Female,University of Perugia,Bauch, Kuhn and Kuhlman,Services
303,Alic,Kelson,282751177,Male,University of Tehran,Padberg, Ratke and Rippin,Marketing
304,Maighdiln,Guilliland,147601513,Female,Universität Vienna,Stanton-McKenzie,Research and Development
305,Alie,Eberz,4707,Female,Fukushima University,Fritsch-Kub,Sales
306,Katya,Clemitt,324461917,Female,Mid-American Bible College,Funk-Doyle,Support
307,Hubert,Drew-Clifton,462401470,Male,John Brown University,Turner, Boyle and Pagac,Marketing
308,Fawnia,Nijssen,862069,Female,EMESCAM - Escola Superior de Ciências da Santa Casa de Misericórdia de Vitória,Mayer, Mitchell and Hyatt,Sales
309,Clarance,Dodding,163652111,Male,Poltava National Technical University,Sauer-Feest,Engineering
310,Anneliese,Binnion,331551449,Female,Universidad Nacional del Centro de la Provincia de Buenos Aires,Turner Inc,Business Development
311,Hamid,Bleiman,461684498,Bigender,Yazd Medical University,Huels, Shanahan and Langosh,Product Management
312,Dorthy,Befroy,774693246,Female,Universidade da Madeira,Jenkins Group,Sales
313,Susi,Docharty,331556752,Female,University of Modena,Kunde-Yundt,Support
314,Rania,Coskerry,923542804,Female,Rockhurst College,Yost-Klein,Business Development
315,Hastings,Stanluck,,Male,Tottori University of Environmental Studies,Jerde Inc,Marketing
316,Madel,Eastope,3439,Female,University of Bihac,Shanahan, Oberbrunner and Kunde,Research and Development
317,Bern,Owttrim,7020,Male,Phillips-Universität Marburg,Dach-Kreiger,Support
318,Arvy,Mungan,336134613,Male,Norwegian State Academy of Music,Price Group,Human Resources
319,Dannie,Breffit,117011345,Male,Wadi International University,Dibbert Inc,Support
320,Kristofer,Wyant,356423,Male,Beder University,Collier, Sanford and Kling,Business Development
321,Hadlee,Sporgeon,334267941,Male,Southwestern Baptist Theological Seminary,Erdman Group,Legal
322,Mikael,Olyfant,802203808,Male,Universitas Pattimura,Wilkinson Group,Support
323,Seamus,Galloway,199581462,Bigender,FON University,Armstrong Group,Engineering
324,Ilene,Kadwallider,494247264,Female,Ecole Nationale Supérieure d'Electrochimie et d'Electrométallurgie de Gernoble,Senger, Oberbrunner and Price,Human Resources
325,Ewen,Brookwell,,Male,University Goce Delcev,Tromp-Crona,Services
326,Karly,Larenson,4730-040,Female,Limkokwing University College of Creative Technology,Padberg-King,Legal
327,Angy,Longley,836722202,Female,Gorgan University of Agricultural Sciences and Natural Resources,Walker-Collins,Business Development
328,Nathalie,Bruffell,871081443,Female,Bircham International University,Will-Homenick,Services
329,Ben,Rosewall,136171450,Male,Bilkent University,Schowalter-Legros,Marketing
330,Sim,Delafont,65571,Male,American Conservatory of Music,Johns Inc,Engineering
331,Marice,Divisek,,Female,Monterey Institute of International Studies,Renner-Mertz,Research and Development
332,Chaunce,Sackler,983623909,Male,Universidad Internacional del Ecuador,Rau Inc,Legal
333,Cindi,Martynov,627047450,Female,Universiti Malaysia Kelantan,Hane, Waelchi and Weimann,Business Development
334,Hoebart,Muldownie,271035614,Male,Northern University Bangladesh,Yundt and Sons,Training
335,Alane,Flooks,,Female,Adygeja State University,Feil-Stehr,Engineering
336,Danya,Bradane,10436,Male,Sadjad Institute of Technology,Cruickshank-Herzog,Sales
337,Mahmud,Lackey,816508510,Male,The College of The Bahamas,Conn-Crooks,Human Resources
338,Valli,Yitzhakov,336154715,Female,Université Claude Bernard (Lyon I),Crona, Cummings and Kuphal,Product Management
339,Tabina,Malec,657751100,Female,Wah Medical College,Mayer-Wisoky,Product Management
340,Cob,Rammell,,Male,University of Grigol Robakidze,Jaskolski Inc,Training
341,Ignace,Callander,152202759,Non-binary,Jinan University,Swift LLC,Human Resources
342,Francesco,Pedican,208741186,Male,Agricultural University of Plovdiv,Grimes, Herman and Beer,Services
343,Lisette,Adamik,187600,Female,Belmont University,Dicki, Weissnat and Bayer,Marketing
344,Damara,Vasyuchov,,Female,National Hispanic University,Zboncak Group,Services
345,Dewain,Tunesi,,Male,National Tainan Teachers College,Mann Group,Human Resources
346,Hollie,Sings,303743070,Female,Johnson Bible College,Haag-Blick,Product Management
347,Eddy,Hartley,024466773,Male,Al-Imam Mohamed Ibn Saud Islamic University,Lehner-Bayer,Product Management
348,Elaina,Turban,802181235,Female,Dawood College of Engineering and Technology,Emmerich Group,Accounting
349,Lacy,Eilhart,606860001,Female,East Delta University,DuBuque, Lowe and Schroeder,Engineering
350,Maryellen,Cattrall,461238361,Genderfluid,Ecole Centrale d'Electronique - ECE,Mayer Inc,Training
351,Rex,Staner,190073101,Male,Ecole Polytechnique Marseille,Roberts-Altenwerth,Training
352,Darcie,Puckinghorne,328919424,Female,Sri Lanka Institute of Advanced Technical Education,Carroll, Kutch and Jacobi,Human Resources
353,Edy,Doberer,331733032,Female,Walailak University,Bechtelar, Hermann and Doyle,Support
354,Consalve,Saffer,,Male,Bukkyo University,Goodwin, Hauck and Fay,Training
355,Wat,Gentil,757011950,Male,The Kingdom University,Howell and Sons,Services
356,Jerad,Dowdeswell,770354563,Male,Universidad de Concepcion,Boyer, Prohaska and Heller,Engineering
357,Sibella,Shorto,263541184,Female,Mount Holyoke College,Lakin, Hahn and Adams,Legal
358,Giana,Conry,09124,Female,Lebanon Valley College,Strosin-Larkin,Human Resources
359,Shanta,Vasilevich,488431002,Genderqueer,Berklee College of Music,Witting, Hermann and Stehr,Human Resources
360,Langston,Hentze,,Male,Instituto Politécnico de Portalegre,Mayert LLC,Accounting
361,Stanislaw,Boykett,198053165,Male,University of Kalyani,Cartwright, Streich and Gusikowski,Support
362,Rodrique,Voice,,Male,Kyoto Bunkyo University,Bauch-Connelly,Accounting
363,Kikelia,Hares,187412,Female,Universität der Bundeswehr Hamburg,Bayer-Schroeder,Engineering
364,Uriel,Geffinger,422235318,Male,Weill Medical College of Cornell University,Spinka, Moen and Hessel,Marketing
365,Inez,Peasgood,020623487,Female,Almustafa Open University,Reinger-Runolfsdottir,Support
366,Meridel,O'Daly,505741028,Female,Gaziosmanpasa University,Dooley LLC,Sales
367,Junie,Swaton,179013625,Female,University of New England, Westbrook College Campus,Bogisich, Cruickshank and Gusikowski,Engineering
368,Brody,Loud,482670001,Male,Karlshochschule International University,Lueilwitz and Sons,Services
369,Barton,Jurkiewicz,828014221,Male,Universitas Negeri Semarang,Schaefer-Skiles,Human Resources
370,Bartholomew,De Blasi,463110800,Male,University of Nottingham,Harris, Reichel and O'Hara,Product Management
371,Rozelle,Caddy,514427584,Female,Universidad Simón Bolivar,McKenzie and Sons,Support
372,Marta,Poulsen,647241609,Female,Johns Hopkins University,Willms LLC,Training
373,Mace,Jeandin,007391650,Male,Southern Methodist University,Hilll-Lebsack,Engineering
374,Toby,Grouen,495064810,Female,China Three Gorges University,Little, Wilderman and Gottlieb,Legal
375,Chane,Meggison,972920800,Male,Crimea State Medical University,Homenick, Gerhold and Aufderhar,Training
376,Pamelina,Joinson,,Female,Dongseo University,Hansen-Schuppe,Marketing
377,Salome,Garfath,067906679,Female,Doshisha Women's College of Liberal Arts,Klocko Inc,Accounting
378,Fernanda,Ivanishin,306062797,Agender,National Defense University,Parker-Pollich,Services
379,Cirstoforo,Le Pine,5285,Male,Kuban State University of Agriculture,Purdy-Tremblay,Product Management
380,Honey,Gilliland,021181951,Female,Fujian Medical University,Kulas-Padberg,Sales
381,Fifi,Ferroni,795537813,Female,University of Science and Technology Sana'a,Paucek-Spinka,Legal
382,Elmo,Stellino,,Male,Universitas Syiah Kuala,Medhurst-Cronin,Sales
383,Kayle,Pargiter,763 62,Female,Allama Iqbal Open University,Corwin LLC,Research and Development
384,Karna,Izakovitz,751543833,Female,Notre Dame Women's College,Koelpin, Dooley and Dare,Research and Development
385,Franciska,Grinsted,639013930,Female,Ferris University,Abshire-Hoppe,Services
386,Chiarra,Veitch,927085409,Female,Salem College,Pouros-Lesch,Support
387,Bo,Carlon,3832,Agender,University of Tennessee Space Institute,Skiles-Harris,Sales
388,Willy,Newart,439522364,Female,Kwansei Gakuin University,Blanda Group,Support
389,Haydon,Herrema,44106,Male,Afghan University,Weber LLC,Business Development
390,Juliane,Pryer,253142010,Female,Hawassa University,Kshlerin Inc,Training
391,Chuck,Lamas,253091311,Male,Obirin University,Jast LLC,Marketing
392,Darby,Vanyakin,706483187,Male,Northern Kentucky University,Rempel, Feeney and Crona,Accounting
393,Homere,Ackery,926633526,Male,National Academy for Physical Education and Sports Bucharest,Flatley Group,Services
394,Angelle,Vanlint,978500460,Female,Barry University,Kiehn and Sons,Support
395,Susanne,Deevey,296072101,Female,Sharif University of Technology, Kish Campus,Schaefer, Reynolds and Champlin,Services
396,Darwin,Grayston,780285329,Male,Miami University of Ohio,Halvorson-Crooks,Product Management
397,Tani,Bernhardsson,026015133,Female,Charles R. Drew University of Medicine and Science,Raynor, Casper and Miller,Human Resources
398,Cullin,Mollnar,731125300,Male,Yeditepe University,Rolfson, Orn and Glover,Product Management
399,Maxine,Moulder,,Female,Eastern University of Sri Lanka,Kerluke-Buckridge,Sales
400,Sharity,Clemas,706055900,Female,Carnegie Mellon University,Yundt, Parisian and Stoltenberg,Services
401,Nissie,Markushkin,331801204,Female,Sophia University,Deckow LLC,Sales
402,Isaiah,Cinavas,427314,Male,Earlham College,Cronin-Kutch,Engineering
403,Averil,Belz,599377849,Female,Harare Institute of Technology,Schneider, Marks and Bergstrom,Business Development
404,Brina,Winter,606770001,Polygender,Georgia College & State University,Yost LLC,Research and Development
405,Fanchon,Buffy,241122937,Bigender,University of Economics Prague,Dibbert LLC,Legal
406,Becca,Conaghy,675472329,Female,Tokyo Medical College,Legros-Streich,Human Resources
407,Tymothy,Worsom,394520607,Male,International University of Business Agriculture and Technology,Rolfson, Raynor and Pfannerstill,Support
408,Francesca,Stidworthy,98880,Female,University of Agriculture and Veterinary Medicine Iasi,Franecki, Rowe and Robel,Training
409,Aubrie,Hacon,730704006,Genderqueer,Osaka City University,Nikolaus-Graham,Legal
410,Vite,Duigenan,770561791,Genderfluid,St. John's College Maryland,Smith LLC,Accounting
411,Pavlov,Wolfendell,81505,Male,Fachhochschule Kiel,Hayes, Prosacco and Brekke,Engineering
412,Dreddy,Giblin,,Female,Savannah College of Art and Design,DuBuque, Crooks and Witting,Services
413,Calli,Bloy,6507,Female,Nairobi Institute of Business Studies ,Gulgowski, Bernier and Kozey,Training
414,Marlow,Roderick,44-290,Male,Universidad Autónoma de Querétaro,Hamill-Mertz,Human Resources
415,Kyle,Spyer,331756302,Female,University of Bialystok,Kertzmann, Huels and Hessel,Business Development
416,Prentiss,Buttfield,,Male,Private FernFachhochschule Darmstadt,Wilkinson-Mertz,Product Management
417,Aeriel,Smallshaw,291161245,Female,University of Illinois at Chicago,Turner and Sons,Training
418,Elfrida,Haskins,,Female,Westminster International University in Tashkent,Torp-Predovic,Business Development
419,Bryce,Maddison,,Male,Universidad Agroforestal Fernando A.Meriño,Denesik Group,Marketing
420,Alexi,Struthers,472502002,Female,PTPL College,Tremblay and Sons,Human Resources
421,Sukey,Johnsson,33233,Female,Bamiyan University,Rolfson, Ritchie and Parker,Engineering
422,Nikola,McIlriach,221935161,Male,Universität Innsbruck,Lemke, Aufderhar and Crona,Marketing
423,Damiano,Rossi,103121807,Male,St. Olaf College,Beier-Moen,Engineering
424,Marga,Rosenauer,334322754,Female,Hokkaido Tokai University,Effertz, Sawayn and Kassulke,Human Resources
425,Bondy,Flemming,935553130,Male,Ecole Supérieure des Sciences et Technologie de l'Ingénieur de Nancy,Sawayn, Willms and Stracke,Accounting
426,Johannes,Russon,490093016,Male,Universidad Adventista de Bolivia,Hettinger-Klein,Training
427,Ashlen,Thickett,786548602,Female,Sultan Azlan Shah Polytechnic ,Braun, Connelly and Okuneva,Marketing
428,Luella,Gwinnell,,Female,Schiller International University, Madrid,Casper Inc,Research and Development
429,Wes,Jandel,200102916,Male,Wenzhou Medical College,Feil, Roberts and Collins,Support
430,Chauncey,Wabe,604641948,Male,Abant Izzet Baysal University,Hyatt-Denesik,Product Management
431,Waneta,Bodycote,,Female,Golestan University of Medical Sciences,McClure LLC,Marketing
432,Ashbey,Shambroke,99362,Male,Lincoln University San Francisco,Hirthe Group,Services
433,Terri,Turnbull,,Male,Universidad José Cecilio del Valle,Denesik, Altenwerth and Labadie,Business Development
434,Karmen,Braithwaite,,Female,Notre Dame University,Schmeler and Sons,Support
435,Flem,Oultram,641803929,Male,American World University,Balistreri, Maggio and Corkery,Human Resources
436,Jody,Lotwich,800457106,Genderqueer,Anhui Technical College of Water Resources and Hydroelectric Power,Brown Group,Services
437,Amye,Stemson,467061023,Female,University of Guyana,Crona, Lockman and Hand,Legal
438,Trudey,Imbrey,731399231,Female,University of Seychelles - American Institute of Medicine,Hoeger Inc,Legal
439,Celestina,Tolputt,303847723,Genderfluid,Moore College of Art and Design,Schaefer, Bechtelar and Hessel,Engineering
440,Meggy,Brager,329583230,Female,Centre Universitaire de Technologie,Jakubowski LLC,Support
441,Jacquie,McAirt,219216395,Female,Katholische Fachhochschule Nordrhein-Westfalen,Bergstrom-Thompson,Product Management
442,Lani,Raybould,21204,Female,Ibn Sina National College for Medical Studies ,Lang, Kerluke and Wisoky,Accounting
443,Derwin,Frain,33166,Male,University of Texas at Dallas,Jenkins-Sporer,Services
444,Bucky,Woosnam,372156154,Male,Beijing University of Posts and Telecommunications,Senger, Gutkowski and Auer,Support
445,Teddi,Greenhow,581072168,Female,Al-Aqsa University,Cummings-Wunsch,Support
446,Dynah,Luna,260036379,Female,École Nationale Supérieure d'Ingénieurs de Constructions Aéronautiques,Tremblay and Sons,Sales
447,Tripp,Broadfoot,67950,Genderqueer,Universität Trier,Carter-Sawayn,Research and Development
448,Celinda,Clemmow,49700-000,Female,Hartford College for Women,Legros, Murray and Kertzmann,Product Management
449,Vale,Lockley,982744126,Female,Universidad Nacional Mayor de San Marcos,Schneider-Schmeler,Accounting
450,Delainey,O'Halligan,922703221,Male,Shanghai Medical University,Pfeffer-Lang,Support
451,Gertrudis,Gingell,346893790,Female,Ecole Polytechnique Marseille,Williamson and Sons,Business Development
452,Lona,MacGillavery,543052487,Female,Fundación Universitaria del Area Andina. Sede Pereira,Littel-Rogahn,Legal
453,Lyndsey,Ladell,756623518,Female,Ohio State University - Lima,Hauck, Goodwin and Steuber,Human Resources
454,Cherey,McHugh,,Polygender,Universidad Autónoma Juan Misael Saracho,Pfeffer LLC,Training
455,Polly,Stanistrete,136691142,Bigender,Ecole Supérieure d'Ingénieurs et de Techniciens pour l'Agriculture,Aufderhar-Kuhlman,Research and Development
456,Prissie,Becarra,469471528,Female,Isra University,Gislason-Waelchi,Business Development
457,Darryl,Carrel,908074422,Male,Universidad Fidélitas,Rempel, Stracke and Frami,Services
458,Corabel,Deeves,963501200,Female,Mustafa International University,Luettgen, Abernathy and Zboncak,Business Development
459,Emmalynn,Oxby,370274536,Non-binary,Fasa Faculty of Medical Sciences,Schuppe, Durgan and Buckridge,Accounting
460,Thia,Downe,779574045,Female,Akrofi-Christaller Institute of Theeology, Mission and  Culture,Cartwright Inc,Engineering
461,Melva,Guymer,750927069,Non-binary,La Trobe University,Mann, Bayer and Auer,Accounting
462,Marika,Buscher,532788866,Genderfluid,St. Petersburg State University of Economics and Finance,Sanford Inc,Marketing
463,Margarette,Toal,765445060,Female,Faculté Polytechnique de Mons,Hauck, Yost and Mayer,Sales
464,Rebeka,Cairney,941183101,Bigender,Universidad de La Salle,Hammes and Sons,Marketing
465,Obediah,Caldicott,952103339,Male,Franklin College,Cartwright and Sons,Human Resources
466,Stefania,Skaid,716390887,Female,St. Petersburg State University of Engineering and Economics,Dickens-Stanton,Human Resources
467,Archibold,Cassells,021385502,Male,Institut Commercial de Nancy,Prosacco-Konopelski,Legal
468,Gardie,Ardern,900741515,Male,Academy of Economic Studies of Moldova,Tremblay-Skiles,Services
469,Kinnie,Polglaze,,Male,Bila Cerkva State Agrarian University,Fisher LLC,Product Management
470,Denna,Deakins,194645008,Female,Hochschule für Gestaltung und Kunst Zürich,Kiehn, Krajcik and Wolff,Training
471,Mead,Shilladay,92885 CEDEX 9,Male,Instituto Superior de Gestão - ISG,Schaden LLC,Accounting
472,Mohandis,Bachura,773395222,Male,Tianjin Normal University,Adams, Frami and Walter,Legal
473,Leila,Lilywhite,112172208,Female,Osaka University of Economics & Law,Jones-Dare,Business Development
474,Brandais,Neilly,750102201,Female,Mehran University of Engineering & Technology,Weissnat, Lemke and Shields,Business Development
475,Cecilia,Kightly,91501,Female,Al Nahrain University,Brekke, Little and Lang,Services
476,Red,Washington,667627587,Male,Arabian Gulf University,Waelchi, Little and Funk,Services
477,Selig,Thorowgood,631500001,Male,Kunitachi College of Music,Nitzsche and Sons,Business Development
478,Ida,Klimowicz,514422210,Female,Herzen State Pedagogical University of Russia,Bartell, Hermann and Franecki,Services
479,Cooper,Anthiftle,331695710,Male,Ho Chi Minh City University of Pedagogics,Daniel, Glover and Cassin,Services
480,Shirl,Tace,544567218,Non-binary,Greenheart Medical School,Halvorson-Lowe,Engineering
481,Aylmar,Sprowell,60616,Male,Caucasus University,Little-Bradtke,Human Resources
482,Golda,Olifard,794155346,Female,Chinese People's Public Security University,Hahn Inc,Training
483,Mortie,Alvarado,442541031,Male,Catholic University of Pusan,Ledner-Beer,Accounting
484,Yettie,Grimsley,4580-313,Female,Pace University  Pleasantville/Briarcliff,Pacocha, Kemmer and Towne,Services
485,Caren,Barton,750576011,Female,Technological Education Institute of Mesologgi,Jerde-Johns,Business Development
486,Cristine,Smithe,019071335,Female,Al-Aqsa University,Dicki, Runolfsdottir and Orn,Training
487,Alfred,Adanet,188346603,Male,Academy of Arts,Stamm LLC,Product Management
488,Stacy,Wellfare,,Male,Universität Duisburg-Essen,Doyle-Romaguera,Support
489,Olive,Malloch,900740152,Female,Niigata Sangyo University,Yost, Monahan and Zieme,Research and Development
490,Aindrea,Lenden,296200887,Female,St. John Fisher College,Corwin, Prohaska and Bradtke,Support
491,Austin,Bucknall,802044507,Male,Universidad de Ciego de Avila,Hansen, Mueller and Farrell,Accounting
492,Gage,Vaney,238590,Male,Universidad México Internacional,Jenkins, Haag and Brakus,Product Management
493,Edgardo,Fowlston,330155109,Male,Rajasthan Technical University,Pfannerstill-Purdy,Accounting
494,Leelah,Ochiltree,158011440,Female,Northwest University,Howe, Rempel and Mayer,Research and Development
495,Minta,Chamberlain,021111526,Female,Technological University of the Philippines,Farrell-Fisher,Training
496,Birdie,Rennocks,080024202,Female,Pädagogische Hochschule Weingarten,Gutkowski and Sons,Human Resources
497,Laurice,Kunzler,,Female,Universidade Federal de São Paulo,Douglas-Borer,Training
498,Nealy,Wormstone,750281892,Polygender,DeVry Institute of Technology, Columbus,Monahan LLC,Research and Development
499,Beale,Graalman,982231642,Male,University of Nebraska - Kearney,Gutmann-Schimmel,Engineering
500,Avram,Glencrash,342374302,Male,Universitas Negeri Jakarta,Medhurst Inc,Support
501,Cherianne,Hillhouse,331725933,Female,Fachhochschulstudiengänge der Wiener Wirtschaft,Paucek, Gerhold and Anderson,Training
502,Judi,Ranscomb,461684300,Female,Mississippi College,Balistreri Group,Services
503,Meriel,Gigg,4620-526,Female,Universidad Nacional de General San Martín,Murazik Inc,Support
504,Mommy,Cake,86-122,Female,Universidade Regional Integrada do Alto Uruguai e das Missões,Davis, Runte and Will,Training
505,Dexter,Caban,,Male,Governors State University,Predovic LLC,Training
506,Veriee,Haps,331772785,Female,Universidad Nacional,Stamm-Reichert,Sales
507,Demeter,Biddleston,180172344,Female,Kookmin University,Krajcik Group,Engineering
508,Enid,Carling,,Polygender,Universidade São Marcos,Waelchi-Brown,Support
509,Carolin,Corneil,468955600,Female,Polytechnic Institute of Turin,Davis, Effertz and Kovacek,Marketing
510,Grantley,Blackden,,Male,Lyceum of the Philippines University,Grant-Koepp,Business Development
511,Nicoline,Bresman,58928-000,Female,Universidad ICESI,Wehner Group,Accounting
512,Fabe,Yuill,054011473,Male,Universitas Pasundan,Zulauf-Toy,Training
513,Ashleigh,Freezor,726532953,Female,Universidad Nacional Autónoma de Honduras,Mante Group,Services
514,Madeline,Lishman,489151925,Female,Goucher College,Considine Inc,Product Management
515,Elfie,Nicholson,662111922,Female,University of World Economy and Diplomacy,Dibbert-Leannon,Accounting
516,Nat,Franciskiewicz,606860081,Male,The Curtis Institute of Music,Greenholt-Swift,Services
517,Shell,Bigmore,978013217,Male,Spertus Institute of Jewish Studies,Cremin-Keeling,Training
518,Jeniffer,Shepherdson,180782574,Female,Institute of Teachers Education, Ilmu Khas,Greenholt, Erdman and O'Hara,Sales
519,Tibold,Argile,232271149,Male,Inner Mongolia Agricultural University,Keeling, Rutherford and Casper,Product Management
520,Murielle,O' Mara,585400039,Female,Xavier University,Bartell-Yost,Business Development
521,Paulo,Egdal,795560690,Male,Missouri Valley College,Cassin-Bode,Training
522,Valeria,Steinham,76598,Female,Brussels School of International Studies,Kozey LLC,Sales
523,Angeline,Daynter,441225203,Female,Universidade Federal de Sergipe,Bogan, Gottlieb and Murazik,Training
524,Timmie,Trask,,Male,Ecole Nationale Supérieure de Biologie Appliquée à la Nutrition et à l'Alementation,Heaney LLC,Marketing
525,Dilan,Foulcher,009265955,Male,Universitas Muhammadiyah Mataram,Breitenberg and Sons,Business Development
526,Lorant,Cartledge,716540351,Male,Laurus Technical Institute,Monahan, Maggio and Keebler,Legal
527,Gay,Dightham,,Female,Nipissing University,Moore, Ledner and MacGyver,Services
528,Berty,Craigg,J2K,Male,University of Derby,Nitzsche-Schoen,Business Development
529,Marven,Donativo,282890860,Male,Universidad Notarial Argentina,Skiles, Satterfield and Collins,Services
530,Paola,Burnup,725 96,Female,University of Wales Institute, Cardiff,Waelchi-Bradtke,Product Management
531,Armando,Jannex,601488897,Male,Polytechnic of Namibia,Kuhlman-Bahringer,Services
532,Lukas,Kemery,34114,Male,University of Sarajevo,Bartoletti-Effertz,Training
533,Hendrika,Leavesley,474015454,Female,St. Elizabeth’s College of Health and Social Sciences in Bratislava,Murray, Schaefer and Murray,Sales
