802,Rakel,Du Plantier,606954088,Female,International School of Management in Prešov,Nader, Hegmann and Homenick,Human Resources
803,Hali,Pendlenton,286460787,Female,Ateneo de Naga University,Schultz LLC,Services
804,Osbert,Sheaber,753908870,Male,National Academy of Fine Arts,Leuschke, Nader and Quitzon,Support
805,Atlante,Klamp,331702714,Female,American Conservatory of Music,Schmeler-Beer,Sales
806,Harlin,Skelbeck,21216,Male,Mahatma Gandhi Chitrakut Gramoday University,Schuster-Nienow,Product Management
807,Joane,Marti,69870-000,Female,Brandon University,Bergnaum-Zemlak,Services
808,Basil,Thridgould,303743070,Male,Universitas Islam Bandung,Daugherty Group,Business Development
809,Clair,Molan,77479,Male,Athabasca University,Huel and Sons,Sales
810,Dorris,Lambeth,442602022,Female,Vidzeme University College,Treutel, McCullough and Kreiger,Research and Development
811,Anny,Curston,799133230,Female,Fuji University,Gottlieb-Lynch,Business Development
812,Chad,Shinton,658075209,Female,Lahore College for Women University,Kuphal-Shanahan,Support
813,Coleman,Goundry,981455005,Male,International Islamic College of Penang,Hammes-McDermott,Support
814,Toby,Landell,,Female,Nanjing Medical University,Brakus LLC,Business Development
815,Celesta,Johnson,368219,Female,Kemerovo State University,Lockman-Pacocha,Support
816,Morrie,Pareman,006811750,Male,Camberwell College of Arts,Rogahn, Corkery and Strosin,Services
817,Jacenta,Purslow,179012710,Female,Randolph-Macon College,Ryan-Ferry,Product Management
818,Jerrilee,Lintall,,Female,Technological University (Mandalay),Schuppe Inc,Support
819,Minne,Neilly,294820040,Female,Universität für Musik und darstellende Kunst Graz,McClure Inc,Services
820,Netti,Althrop,334345310,Female,Covenant College,Wilderman, Lemke and Doyle,Research and Development
821,Nicolina,Boorne,,Female,University of Northern Virginia, Prague Campus,Gottlieb-Balistreri,Marketing
822,Cherlyn,Cheevers,810502751,Female,St. Petersburg State Technological University of Plant Polymers,VonRueden-DuBuque,Accounting
823,Velma,Pyford,462198300,Female,Pace University,Strosin Group,Research and Development
824,Free,Winson,500200276,Male,Emmanuel College,Miller-Cruickshank,Accounting
825,Rollins,Noye,331442575,Male,Escola Superior de Artes e Design,Durgan LLC,Legal
826,Herby,Corke,452633370,Male,University of Constanta Medical School,Kohler Inc,Services
827,Leonard,Ringer,8301,Male,Technological University (Myitkyina) ,Cronin, Murphy and Gleason,Accounting
828,Faythe,Ilson,606123714,Non-binary,Staatlich anerkannte Fachhochschule für Kunsttherapie,Wuckert-Schinner,Engineering
829,Ashley,Petroff,704383688,Male,Tashkent Institute of Irrigation and Melioration,Kuphal-Graham,Research and Development
830,Karlotta,Schruurs,,Female,Technical University of Kielce,Lindgren LLC,Training
831,Shelly,Leggen,895021576,Female,Ecole Supérieure de Commerce de Dijon,Ferry, Moen and Jerde,Sales
832,Bea,Accomb,625264163,Female,East Kazakhstan State University,Bosco-Harris,Services
833,Josey,Tombleson,,Female,Universidad Bolivariana,Cronin LLC,Sales
834,Cleveland,Kidgell,900372415,Male,Politécnico Grancolombiano - Institución Universitaria,Veum-Orn,Research and Development
835,Charis,Ingham,15213,Female,Université de Batna,Nikolaus-Jakubowski,Accounting
836,Ingaberg,Galbreth,452424402,Female,Toho University,Lueilwitz, Homenick and Kirlin,Legal
837,Holden,Aireton,495032560,Male,Universidad Francisco de Vitoria,Nikolaus and Sons,Business Development
838,Roze,Hedney,553443248,Female,Universidad Fermin Toro,O'Reilly-Kub,Legal
839,Jami,Hobbema,75690-000,Female,St. Joseph College of Nursing,Bosco Group,Training
840,Ali,Connochie,900741515,Male,Union University,West Group,Product Management
841,Garrek,Jarmaine,751492434,Male,Ecole Nationale Supérieure de Chimie de Rennes,Grimes, Schmidt and Schoen,Human Resources
842,Christiane,Merryman,646838343,Female,Hokkaido Institute of Technology,Kihn, Pfannerstill and Simonis,Accounting
843,Taber,Borland,137537407,Male,Togliatti State University,Bartoletti-O'Keefe,Engineering
844,Marmaduke,Primett,570032033,Male,Universidad Nacional de San Agustin,Abbott-Volkman,Sales
845,Gerardo,Ridgway,2250,Male,Ch. Charan Singh University,Hegmann-Kunde,Research and Development
846,Launce,Gianettini,92980 CEDEX,Male,Pondicherry University,Schulist LLC,Accounting
847,Michele,Stitt,352830605,Male,University of Wales Institute, Cardiff,Toy and Sons,Accounting
848,Marilyn,Tilney,789571730,Female,University of Pittsburgh,Ondricka, Haley and Wisoky,Sales
849,Nolly,Spilisy,662518,Non-binary,Academy of Arts,Bins-Wilkinson,Legal
850,Jule,Degli Antoni,,Male,William Paterson University,Armstrong, Heller and Simonis,Human Resources
851,Inigo,Wiz,441940002,Male,Universitas Advent Indonesia,Langosh Inc,Business Development
852,Gustaf,Keenlayside,917063241,Male,Ling Tung University,Hodkiewicz-Fadel,Product Management
853,Justen,Fearick,367442316,Male,Medical College of Georgia,Franecki-Howe,Services
854,Arron,Esseby,191826422,Polygender,Kunmimg University of Science and Technology,Dickens-Hegmann,Accounting
855,Adelaide,Gentry,606731264,Female,ISFORT - Institut de Formation en Technologie Alimentaire,Krajcik LLC,Support
856,Kori,MacConnechie,334097021,Female,Seinan Gakuin University,Block and Sons,Support
857,Krystalle,Amori,900840145,Genderfluid,University of Arkansas at Little Rock,Bechtelar-Rice,Accounting
858,Giralda,Artiss,200172180,Female,China Medical College,Watsica-Huel,Product Management
859,Farlee,Bromilow,009213200,Male,Universidad del Istmo,Jacobson, Gleason and Anderson,Research and Development
860,Barbabra,Cruess,249406,Female,Reitaku University,Yost-Kub,Sales
861,Austina,Templeman,472742640,Female,Albany Medical Center,Hayes Inc,Legal
862,Salim,Yakushkev,482011288,Male,Kent State University - Trumbull,Schmidt-Bogisich,Sales
863,Itch,Risen,367560149,Male,Hochschule für Philosophie München,Connelly, Stark and Carter,Research and Development
864,Arnoldo,Gawith,,Male,Maranatha Baptist Bible College,Considine, White and Marvin,Human Resources
865,Yard,Dunkley,,Male,Averett College,Quitzon Inc,Support
866,Eran,Yeskin,69-101,Female,Universidad Católica de Santo Domingo,Schaden, Jast and Koepp,Services
867,Frank,Annesley,009103881,Male,Ibaraki Prefectural University of Health Sciences,Marvin Inc,Product Management
868,Kelsi,Crowter,850122702,Female,Western State University College of Law,Gleichner and Sons,Business Development
869,Ida,De Winton,577017375,Female,Norwich University,Kerluke-Stiedemann,Training
870,Tracy,Gumb,,Male,Moscow Power Engineering Institute (Technical University),Jaskolski and Sons,Business Development
871,Traci,Chestle,670639602,Female,University of the Philippines Manila,Blick, Feil and MacGyver,Training
872,Mignon,Domengue,199634364,Female,Ufa State Aviation Technical University,Mayert, Erdman and Klocko,Research and Development
873,Roxane,Asty,30160,Female,Université Lumière de Bujumbura,Waelchi Group,Business Development
874,Herman,Maes,913642573,Male,Seton Hill College,Pfeffer, Spencer and Effertz,Training
875,Kit,Pechacek,,Male,Alaska Pacific University,Schowalter-Runolfsson,Accounting
876,Peggy,Moores,29118,Female,Sapporo Gakuin University,Yundt, Russel and Hagenes,Legal
877,Franciskus,Spare,463077762,Male,Macau Polytechnic Institute,Hoppe Group,Marketing
878,Nikolos,O'Moylan,,Male,Kamchatka State University Vitus Bering,Bartell Inc,Research and Development
879,Garret,Smewings,171012010,Male,Acdemic Center for Law and Business,Funk-Emard,Engineering
880,Maxy,Dring,058190905,Genderqueer,California State University, Stanislaus,Beier and Sons,Training
881,Issi,Finlayson,926272818,Female,University of New Haven,Windler LLC,Accounting
882,Chrysa,Fish,469522600,Female,College of St. Rose,Flatley Group,Services
883,Trudie,Phillpotts,368692,Female,Cleveland Institute of Art,Fahey-Denesik,Research and Development
884,Ardith,Sunnucks,4612,Genderqueer,Angeles University,Hermiston-Bashirian,Marketing
885,Nikki,Cutchee,333243273,Female,European University,Swift, Keeling and Pacocha,Product Management
886,Juliette,Bille,270304561,Female,Universidad de Cantabria,Cartwright, Hartmann and Russel,Human Resources
887,Ferd,Cowlard,02536,Male,COMSATS Institute of Information Technology, Abbottabad,Gusikowski and Sons,Human Resources
888,Ada,Gamlen,785826211,Female,Budapest Buddhist University,Hamill Group,Legal
889,Toiboid,Gon,00659,Male,Katholieke Universiteit Leuven, Campus Kortrijk,Schuster Inc,Legal
890,Cristin,Yanin,77418,Genderqueer,Cag University,Kub-Moen,Accounting
891,Garvin,Fateley,440942948,Male,Malaspina University College,Kreiger Group,Engineering
892,Modesty,Rayworth,,Female,Ecole Nationale de l'Aviation Civile,Schimmel LLC,Training
893,Tory,Arpino,705083870,Female,Ho Chi Minh City University of Pedagogics,Balistreri, Sipes and Weissnat,Marketing
894,Yolande,Godball,139054198,Female,Universidade Católica de Angola,Schiller-Tillman,Legal
895,Nomi,Lishmund,606775070,Female,Selkirk College,Bruen and Sons,Marketing
896,Eamon,Worland,,Male,Milwaukee School of Engineering,D'Amore, West and Nikolaus,Support
897,Sanford,Percy,,Male,Gezira College of Technology,Keeling Inc,Business Development
898,Lida,Fiennes,493072048,Female,Colorado State University,Bernier-Jast,Product Management
899,Isiahi,Piatti,913676701,Male,Grand View College,Littel-Flatley,Accounting
900,Koralle,Manueau,3070-605,Female,Cornish College of the Arts,Price-McDermott,Business Development
901,Dynah,Blevin,439509119,Female,University Malaysia Pahang,Breitenberg and Sons,Marketing
902,Curt,Konneke,744621611,Male,Swinburne University of Technology,Altenwerth-Wunsch,Sales
903,Cliff,Gietz,461312179,Male,Southwestern Christian University,Runolfsson, Fisher and Simonis,Engineering
904,Yanaton,Itzkovitch,606860081,Male,Handelshochschule Leipzig,Mante-Cummings,Services
905,Arluene,Leverson,381202177,Female,Universidad Blas Pascal,Adams, Conroy and Wolf,Product Management
906,Paton,Comelini,330122748,Male,William and Catherine Booth College,Klocko-Sipes,Product Management
907,Ced,Rimington,,Male,Tongji University,Weber, Murazik and Collier,Business Development
908,Merle,Aland,,Genderfluid,Al-Zaytoonah University,Vandervort-Russel,Engineering
909,Gabriellia,MacIlhagga,31329,Female,Yamanashi University,Nicolas, Boehm and Jenkins,Human Resources
910,Noble,Buckoke,47331,Male,Politécnico Grancolombiano - Institución Universitaria,Schoen-Watsica,Marketing
911,Tulley,Errichi,717110797,Male,Tokyo University,DuBuque, Okuneva and Leffler,Services
912,Tracie,Akred,0031,Female,Altai State Medical University,Cole Group,Support
913,Laina,Liddyard,708163254,Female,Foothill-De Anza Community College District,Koss-Conn,Human Resources
914,Aurthur,Kelk,4800-349,Male,Leon Kozminski Academy of Entrepreneurship and Mangement,Luettgen-Labadie,Human Resources
915,Park,Stannislawski,98670-000,Male,Xinjiang University,Fahey, Zulauf and Price,Business Development
916,Ennis,Faussett,941430001,Male,Georgetown University,Gutmann LLC,Sales
917,Elissa,Everwin,,Female,Dixie College,Predovic Inc,Product Management
918,Merrili,Vittore,100873467,Female,Narsee Monjee Institute of Management Studies,Sauer and Sons,Research and Development
919,Addie,Porson,463250704,Male,Capella University,Konopelski, Crona and Hand,Services
920,Truda,Blackley,441164173,Female,Fairleigh Dickinson University, Teaneck-Hackensack Campus,Glover, Maggio and Kuvalis,Training
921,Lucho,Dowson,900884577,Male,Bindura University of Science Education,Greenholt-Kulas,Research and Development
922,Jacenta,O'Harney,69101,Female,Catholic University of Pusan,Walter LLC,Training
923,Ronna,Glisane,490471943,Female,Instituts Supérieurs de Formation des Maîtres,Graham, Kshlerin and Brekke,Accounting
924,Trude,Rubee,539481931,Female,Brest State Technical University,Orn-Rodriguez,Product Management
925,Egan,Doberer,953709226,Male,Ohio University,Fritsch-Wisoky,Legal
926,Sheila-kathryn,Whild,,Female,Università Bocconi,Hettinger-Feil,Support
927,Cissy,Rodbourne,853230540,Genderfluid,East-West University,Johnston and Sons,Engineering
928,Freddie,Rockhill,138202629,Female,Chinhoyi University of Technology,Considine-Fahey,Services
929,Valeda,Aslott,191826594,Female,Private Universität Witten/Herdecke,Harvey-Goyette,Support
930,Florance,Pellew,662518,Female,Albion College,Hills, Nitzsche and Stroman,Engineering
931,Marietta,Rowter,316030009,Female,University of Portland,Stroman-Hahn,Marketing
932,Trudy,Roydon,700704349,Female,Kobe International University,Renner and Sons,Engineering
933,Alister,Philipsson,259621064,Bigender,University of Central Oklahoma,Deckow and Sons,Legal
934,Lizabeth,Kislingbury,731596708,Female,Mars Hill College,Upton-Schaefer,Business Development
935,Mathilde,Lavrick,,Female,Universidad Surcolombiana,Osinski-Schulist,Engineering
936,Anjela,Linford,423037758,Female,Kagoshima Women's College,Zulauf, McCullough and Reichel,Accounting
937,Lowell,Sagrott,,Male,Central Buganda University,Rau, Zboncak and Nikolaus,Support
938,Brig,Codeman,440011620,Male,Hamilton Technical College,Turner-Mueller,Marketing
939,Lief,Raggles,759614027,Male,College of Computer Science in Lodz,Bergnaum, Bahringer and Anderson,Product Management
940,Hilliard,Marcroft,471504990,Male,Evangelische Fachhochschule Freiburg, Hochschule für Soziale Arbeit, Diakonie und Religionspädagogik,Gutmann, Corkery and Johnston,Research and Development
941,Reeba,Haddinton,,Female,Wentworth Institute of Technology,Wunsch-Parker,Sales
942,Randal,Shilito,,Male,University of Northern Colorado,Weissnat LLC,Human Resources
943,Barney,Tineman,57955-000,Male,Selangor Islamic University College,Larkin, Sporer and Auer,Product Management
944,Bo,Cramond,ZBR,Male,Ecole National d'Agriculture de Meknes,Hodkiewicz Inc,Accounting
945,Duffy,Neasham,60435,Male,Pyongtaek University ,Marvin, Crona and Wehner,Accounting
946,Rebecca,Konig,212630023,Female,Samara State Academy for Railway Transportation,Beahan, Quigley and Schneider,Product Management
947,Pet,Sentance,651096920,Female,Universidad Adventista de Chile,Jacobson, Walker and Jerde,Human Resources
948,Morganne,Dudley,900363010,Female,Kagoshima Immaculate Heart University,Effertz-Gorczany,Engineering
949,Erica,Bridgwater,396490490,Female,Université Dr Tahar Moulay,Schaefer-Mertz,Legal
950,Curt,Danielczyk,486700001,Male,Universidad Internacional Menéndez Pelayo,Oberbrunner-Pagac,Business Development
951,Kara,Dhennin,773770889,Female,Medical University of Sofia,Hills, Blanda and Moen,Human Resources
952,Karl,Ramme,616145069,Male,Tamil Nadu Veterinary and Animal Sciences University,Gislason Group,Sales
953,Bern,Glason,954536300,Male,Thomas University,Barton-Simonis,Human Resources
954,Karee,O'Monahan,758627602,Female,Mount Vernon College,Streich, Toy and Zulauf,Services
955,Giulia,Crookshank,,Female,Technical University of Szczecin,Pfannerstill-Haley,Accounting
956,Donavon,Blanchette,,Male,Universidad del País Vasco,Hudson-Wunsch,Product Management
957,Grazia,Eggar,761025841,Female,Adnan Menderes University,Weber LLC,Legal
958,Alejoa,Rodda,423470126,Male,Notre Dame University,Wilderman, Harris and Becker,Research and Development
959,Clio,Dutton,832130145,Female,Cogswell Polytechnical College,Runolfsdottir Group,Product Management
960,Gwenneth,Lawfull,478024749,Female,Nalanda Open University,Sauer-Swift,Engineering
961,Jocko,Lavington,,Male,Ulyanovsk Higher School of Civil Aviation,Frami-Blick,Research and Development
962,Kingsley,Alpe,753911875,Bigender,Bicol University,Olson, Fritsch and Schowalter,Sales
963,Corey,Kohler,762402002,Male,University of Petroleum (East China),Trantow-Beatty,Business Development
964,Krissie,Lukasen,731104201,Female,University of Medicine and Pharmacy of Timisoara,Cummerata Group,Human Resources
965,Kinnie,Humbey,782369907,Male,Universiti Teknikal Malaysia Melaka,Johnston LLC,Support
966,Conway,Plant,145349530,Male,Ontario College of Art and Design,Toy, Johnson and Reichert,Engineering
967,Rock,Baytrop,755 01,Male,Southern New Hampshire University,Bernhard, Spinka and Heaney,Accounting
968,Brok,Adhams,051563050,Male,Odense University,Barton, Price and Fisher,Human Resources
969,Hoyt,Daveren,727035521,Male,National Tsinghua University,Auer, Connelly and Stamm,Marketing
970,Genevra,Kittow,,Female,Yorker International University, Milano,Gleichner, Christiansen and Wehner,Support
971,Northrop,Leupoldt,30103,Male,Institut Teknologi Bandung,Powlowski, Goyette and Crona,Product Management
972,Gratiana,Yetts,634011239,Female,University of Southampton,Botsford and Sons,Sales
973,Rabi,Matteris,304010879,Male,Kameshwar Singh Darbhanga Sanskrit University,Pagac, Powlowski and Von,Training
974,Farrell,Dancer,784660465,Male,Palm Beach Atlantic University,Cole Group,Services
975,Aksel,Corp,151087726,Male,Technical University of Gdansk,Purdy, Runolfsdottir and Emmerich,Services
976,Oswald,Ericsson,311932540,Male,Université de Nice-Sophia Antipolis,Wiegand, MacGyver and Jaskolski,Product Management
977,Roslyn,Buddock,934367337,Female,School of the Museum of Fine Arts,Powlowski, Quigley and Corwin,Research and Development
978,Toby,Nutton,852466700,Male,Tamil Nadu Dr. Ambedkar Law University,Goldner-Mann,Engineering
979,Annabella,Mousby,372211758,Female,United States Military Academy,Lesch Inc,Accounting
980,Missy,Cuppitt,630802354,Female,Luther College,Renner-Pfannerstill,Legal
981,Meier,Blabber,31551,Male,Technological Education Institute of Serres,Ratke Group,Research and Development
982,Kathie,Raffin,396530744,Female,University of the Southern Caribbean,Gutmann, Harber and Zulauf,Product Management
983,Kris,Abramovitch,402012587,Male,Islamic Azad University, Central Tehran Branch,Zboncak, Streich and Jones,Services
984,Fanechka,Busson,007511162,Female,Metropolitan State College of Denver,Raynor Inc,Engineering
985,Trenton,Bannard,900840149,Male,Azerbaijan State Economic University,Mann-Daugherty,Support
986,Miguel,Teanby,989263875,Male,SMK Fomra Institute of Technology,Howell, Bosco and Schoen,Research and Development
987,Dannie,Ahern,434522001,Female,Al Mansour University College,Reinger-Pfannerstill,Research and Development
988,Rafa,Shucksmith,138202099,Female,Seton Hall University,Fisher Inc,Business Development
989,Riane,Bertlin,006012201,Female,University of Manchester,Walsh-Weber,Engineering
990,Fidela,Laughren,606123833,Female,Converse College,Crist Inc,Research and Development
991,Gratiana,Souter,604770967,Female,Lahore University of Management Sciences,Legros, Stoltenberg and Schumm,Business Development
992,Brittaney,Addekin,900331029,Female,Technical University of Wroclaw,Prohaska and Sons,Support
993,Elvis,Blezard,40000,Male,Concordia University, Irvine,Ruecker Group,Services
994,Giustino,Derell,812010429,Male,Yunnan Agriculture University,Hilll-Parisian,Accounting
995,Leupold,Trayling,956084021,Male,Camberwell College of Arts,Volkman-Bernier,Services
996,Stanfield,Zupo,309096521,Male,Morehead State University,Willms-Bartoletti,Accounting
997,Waldemar,Scamel,145131057,Male,Hunan Agricultural University,Dooley-Durgan,Services
998,Domingo,Kenneford,989440719,Male,Poltava National Technical University,Windler Inc,Legal
999,Jessi,Beckworth,480755403,Female,European University at St.Petersburg,Herman-Parker,Product Management
1000,Pavel,Rosendale,330154352,Male,West Virginia University Institute of Technology,Leuschke-Beatty,Accounting
