534,Latisha,Ingham,792011030,Female,University of New Haven,Marquardt-Herzog,Training
535,Merissa,Fleischer,903042514,Female,Bloomfield College,Treutel Group,Sales
536,Sidonia,Peckham,525569572,Female,Hochschule Esslingen,Parker, Dibbert and Jakubowski,Legal
537,Ediva,Chaudron,802203808,Female,City University of New York, Queens College,Stroman-Nader,Legal
538,Coralyn,Pessler,212231558,Female,University of the Philippines Visayas - Cebu High School,Corkery, Reinger and Corwin,Human Resources
539,Christian,Lickess,941450680,Female,Technical University of Crete,McClure-Satterfield,Training
540,Juana,Sabban,300678237,Female,Iranian Academy of Persian Language and Literature,Stracke and Sons,Sales
541,Ugo,Ingram,764581403,Male,Collegium Civitas,Dare and Sons,Accounting
542,Dana,Yacobsohn,370671509,Male,American InterContinental University Online,Walter, Murray and White,Accounting
543,Anderea,Stainland,395021810,Female,University of the Sunshine Coast,Runolfsdottir-Murphy,Research and Development
544,Myron,Duthie,495032560,Non-binary,Université de Toliary,Gerlach Inc,Research and Development
545,Burtie,Curnow,286212445,Male,Kyoto Bunkyo University,Kreiger, Bailey and Wisozk,Legal
546,Barrie,Jagger,009606057,Male,Benedictine College,Haley, Koss and Kihn,Marketing
547,Martin,Putten,321745133,Male,Youngstown State University,Kunze Group,Business Development
548,Robinette,Detoc,295269142,Female,Busitema University,Nienow, Carter and Schmitt,Services
549,Calvin,Gilliver,372156293,Male,Hehai University,Lehner LLC,Marketing
550,Arlinda,Castelow,,Female,Hochschule Vechta,Dibbert, Rath and Nolan,Product Management
551,Arielle,Vanlint,152322421,Female,International University of Health and Welfare,Torp-Kemmer,Business Development
552,Rafe,McAuslene,606405710,Male,Tambov State Technical University,Batz and Sons,Business Development
553,Verge,Flay,785826999,Male,Eastern Virginia Medical School,Prosacco, Russel and Homenick,Training
554,Katee,Streat,,Female,Shah Abdul Latif University Khairpur,Pfeffer, Schmidt and Schmitt,Support
555,Lida,Hand,33406,Female,Brookdale Community College,Rogahn, Feeney and Luettgen,Sales
556,Sherill,Causey,328198200,Female,Elmira College,Larson, Nitzsche and Grady,Accounting
557,Shermie,Dando,934360909,Male,University of Science and Technology Beijing,Jacobson, Greenholt and Gerhold,Engineering
558,Hillier,Reason,807-0133,Male,Universidad Nacional del Comahue,Brekke Inc,Sales
559,Ramona,McMonnies,480333849,Female,Fachhochschule Mannheim, Hochschule für Technik und Gestaltung,Hintz-Walter,Human Resources
560,Rosamond,Davage,606860081,Female,Fine Arts Academy in Poznan,Casper, Schumm and Dickens,Research and Development
561,Bryn,Asken,,Female,Imperial College London,Leuschke-Schimmel,Support
562,Augusto,Heinssen,287792722,Male,London School of Economics and Political Science, University of London,Stoltenberg, Rutherford and Schuster,Research and Development
563,Melesa,Leaming,45710-000,Female,Universidad Nacional de San Martín,Crona and Sons,Legal
564,Arie,Surgey,833305500,Male,Music Academy "Stanislaw Moniuszko" in Gdansk,Bauch LLC,Services
565,Maribeth,Mityashev,104672545,Female,Université des Antilles et de la Guyane,Witting LLC,Training
566,Gilbertina,Bratten,8310,Female,Universitas Katolik Soegijapranoto,Ryan-Volkman,Training
567,Kent,Lease,,Male,Instituto Universitario Aeronáutico,Herman Inc,Human Resources
568,Raddy,Smy,454295164,Male,University of Rousse,Runolfsson, Blanda and Hartmann,Marketing
569,Bond,Sheather,5340-197,Male,Seinan Gakuin University,Marvin-Zemlak,Training
570,Hedi,McIlvoray,482011286,Female,American University of Kuwait ,Schuppe, Douglas and Beatty,Engineering
571,Kevon,Zanicchelli,486700001,Male,University of Venice,Farrell, Mann and Bahringer,Product Management
572,Goraud,Formie,724541911,Male,Taganrog State University of Radioengineering,Schaden-Stoltenberg,Business Development
573,Raynell,Metzig,933013731,Female,Al Maarif University College,Bode-Schamberger,Support
574,Niko,Birkmyr,581047927,Male,Maryam Institute of Higher Education,Welch, Cartwright and Legros,Support
575,Ferdinande,Rault,943041117,Female,University of East,Nienow-Beier,Human Resources
576,Davidson,Vasiljevic,526279611,Male,Ecole Supérieure de Commerce de Marseille-Provence,Stoltenberg Inc,Human Resources
577,Marrissa,Kording,282750216,Genderqueer,Sanaag University of Science and Technology,Bechtelar, Parker and Haag,Training
578,Charmain,Snashall,191787642,Non-binary,Atomi College,Watsica-Wilderman,Training
579,Dian,Physick,531 85,Female,Ecole Mohammadia d'Ingénieurs,Gleichner, Olson and Koelpin,Product Management
580,Rosie,Prin,00740,Female,Bethany College California,Wintheiser-Russel,Legal
581,Giuseppe,Whitehall,432131546,Male,Khabarovsk State University of Technology,Vandervort and Sons,Support
582,Duffie,Pakes,,Male,University of Greenland,Schmitt-Bailey,Accounting
583,Mirabelle,Bench,840977707,Female,University of Arkansas for Medical Sciences,Ziemann LLC,Legal
584,Grace,Barck,342772548,Agender,Motilal Nehru National Institute Of Technology,Lesch Inc,Business Development
585,Adaline,Pryke,201863027,Female,Escuela Politécnica de Chimborazo,D'Amore, Ziemann and Dare,Marketing
586,Ody,Pennacci,,Male,Haverford College,Spencer, Rohan and Carroll,Engineering
587,Kristel,Kemmis,,Bigender,Nalanda Open University,Bahringer, Kertzmann and Wisozk,Accounting
588,Rebekkah,Cuttles,394077,Female,Universidad de Puerto Rico, Rio Pedras,Kemmer, O'Conner and MacGyver,Services
589,Rodrick,Reskelly,1291,Male,Lithunian Institute of Physical Education,Johnston-White,Support
590,Randi,Lidstone,275605491,Male,Our Lady of Holy Cross College,Hansen, Hand and Schmidt,Engineering
591,Pavel,Bugge,852246141,Male,National University of Science and Technology,Sanford Group,Human Resources
592,Joelie,Grgic,283582118,Female,Luhansk State Medical University,D'Amore Inc,Training
593,Erena,Smieton,31224,Female,Universidad del Mayab,McCullough, Okuneva and Buckridge,Accounting
594,Arnold,Dunge,597299998,Male,American University of the Caribbean, Sint Maarten,Harvey, Weissnat and Harber,Services
595,Nadine,Brunke,,Female,DeVry Institute of Technology, DuPage,Moore-Quitzon,Marketing
596,Aline,Sponton,4615-099,Female,Gulhane Military Medical Academy,Morar-Cremin,Accounting
597,Brad,Rosenfield,816014227,Male,Akita University,Koch-Batz,Human Resources
598,Calli,Siege,022415661,Female,Vilnius Gediminas Technical University,Pouros and Sons,Services
599,Pietro,Dake,707375004,Male,Lake Superior State University,Breitenberg, Marquardt and Kilback,Services
600,Arch,Gendrich,526412263,Male,Hamilton Technical College,Kuphal and Sons,Legal
601,Vern,Collin,78942 CEDEX,Male,St.Kliment Ohridski University,Rowe LLC,Services
602,Ollie,Urian,232271149,Male,Academy of Economics "Dimitur A. Tscenov",Collins Group,Support
603,Rosita,Dow,104515504,Female,Planwel University,Kub Group,Product Management
604,Frances,Yesinin,604321439,Female,Kogakuin University,Muller-Schultz,Legal
605,Kristian,Antoniak,,Male,Institut Catholique d'Arts et Métiers Lille,Watsica, Fahey and Braun,Business Development
606,Kerr,Denniss,871093136,Polygender,University of Bunkyo,Crist, Dare and Kuvalis,Product Management
607,Millicent,Nertney,3210,Female,Universidade Atlântica,Kiehn-Schoen,Support
608,Any,Kurten,,Male,Beijing University of Agriculture,Koss-Bartoletti,Legal
609,Fleming,Boucher,295660547,Male,Universidad Autónoma Metropolitana - Azcapotzalco,Parisian LLC,Accounting
610,Guillema,Bowell,368304257,Female,Global University,Vandervort, Beatty and White,Product Management
611,Donnie,Pasfield,381202177,Male,Medical Academy Ludwik Rydygier in Bydgoszcz,Feeney-Jacobson,Marketing
612,Millicent,Bottinelli,72401,Female,Veliko Turnovo University "Cyril and Methodius",Ruecker, Durgan and Kunde,Product Management
613,Louis,Faircloth,74004 CEDEX,Male,Netaji Subhas Inst of Technology,Torp-Boyle,Human Resources
614,Wilhelmine,Skase,705104039,Female,Université du Québec à Rimouski,Walker, Watsica and Shields,Support
615,Florida,McRobbie,331756302,Female,Gujarat Ayurved University,Heaney, Schinner and Donnelly,Training
616,Genna,Patterfield,43150,Non-binary,Adler School of Professional Psychology,Stoltenberg and Sons,Support
617,Vinni,Bendon,857126051,Genderfluid,Ecole Supérieure de Commerce de Bordeaux,Cronin and Sons,Training
618,Donetta,Cruickshanks,928683849,Female,Ecole Normale Supérieure de Paris,Gusikowski, Rosenbaum and Nader,Support
619,Tyne,Sails,,Female,University College of Cape Breton,Botsford-Lockman,Accounting
620,Kinny,Heelis,115901740,Male,Agricultural-Technical Academy in Olsztyn,Crooks Group,Services
621,Lorene,Lawlings,P0M,Genderqueer,Escuela Nacional de Estudios Superiores Unidad León,Zieme and Sons,Product Management
622,Isaak,Forth,,Male,Pwani University,Bode, Gleichner and Leannon,Accounting
623,Othilia,Dries,087015928,Female,Kumamoto Prefectural University,Wolf LLC,Support
624,Dorrie,Birchwood,606163395,Female,Trinity International University,O'Hara LLC,Business Development
625,Rand,Lambe,912 99,Male,Universidad Nacional Daniel Alcides Carrion,Casper Inc,Marketing
626,Carny,Burleigh,283090908,Male,Fred Hutchinson Cancer Research Center,Reynolds, McLaughlin and Shanahan,Product Management
627,Edouard,Alentyev,80130,Male,Technological University of the Philippines,Barrows LLC,Training
628,Archy,Shilliday,,Male,Christ University,Rosenbaum-Haley,Training
629,Berk,Shadrack,686021800,Male,Fachhochschule Kempten, Hochschule für Technik und Wirtschaft,Toy LLC,Sales
630,Annalee,Groll,347485925,Female,Barat College,Kovacek, Champlin and Gutkowski,Sales
631,Kimble,Fist,390383806,Male,Universidad Politécnica de Cataluna,Grimes, Armstrong and Parisian,Human Resources
632,Solomon,Rigardeau,331553009,Male,Royal College of Surgeons,Emard-Koch,Legal
633,Min,Warrilow,717540629,Female,St. Augustine International University,Effertz LLC,Human Resources
634,Willem,Clethro,,Male,Graduate Theological Union,Rau-Jacobs,Business Development
635,Urbain,Ziems,668461422,Male,University of Southern Queensland,Carter Group,Support
636,Henry,Quinell,816014286,Male,Hyogo University of Education,Cremin, Shanahan and Pouros,Legal
637,Odelia,Paulino,622080215,Female,Northwood University, Florida Campus,Will, Christiansen and Borer,Support
638,Violette,Oaks,423470148,Female,Abant Izzet Baysal University,Klocko, Barrows and Huel,Services
639,Durant,Oller,461684300,Male,Okayama University of Science,Lehner Inc,Legal
640,Kippy,Tennewell,769021879,Male,Dawood College of Engineering and Technology,Johnson LLC,Engineering
641,Ainslee,Pickerin,814014212,Female,Morris Brown College,Gislason LLC,Sales
642,Ralf,Archibold,850122702,Male,Universidad INCCA de Colombia,Brekke, Willms and Hessel,Engineering
643,Guinevere,Lowndsbrough,070423505,Female,Fachhochschule Stuttgart, Hochschule für Technik,Heaney, Champlin and Kirlin,Human Resources
644,Reta,De Souza,7210,Female,Punjab Engineering College Deemed University,Mraz Inc,Legal
645,Giusto,Reneke,170330858,Male,Ursuline College,Swift-Hickle,Legal
646,Fiann,David,606243,Female,Hochschule Magdeburg-Stendal (FH),Crist Inc,Support
647,Rowen,Whiffen,711113105,Male,Royal Danish Academy of Fine Arts, School of Visual Art,Turner Inc,Engineering
648,Skyler,Lafont,,Male,Tohwa University,Morissette Group,Support
649,Nada,Farnill,282199305,Female,California State University, Northridge,Stracke-Padberg,Business Development
650,Guillaume,Tinson,,Male,Florida Metropolitan University, Fort Lauderdale College,Howell and Sons,Support
651,Bobine,Petrishchev,309046258,Female,Nihon University,Green Inc,Engineering
652,Fons,Jowling,735549117,Male,Tunku Abdul Rahman Chinese College,Crist Group,Support
653,Nessy,Stilwell,840436651,Female,King Saud University,Dooley Group,Business Development
654,Kathe,Tolussi,554860013,Female,Western Mindanao State University,Cruickshank-Kirlin,Product Management
655,Krispin,Marcos,611100067,Male,Bahria University,Ferry-Block,Training
656,Abbey,Coales,606860081,Male,Regent University College of Science and Technology  ,Lakin, Little and Kovacek,Engineering
657,Peggi,Vigurs,128010304,Female,University of Bialystok,Medhurst Inc,Sales
658,Chicky,Grunder,900885904,Male,Medical College of Georgia,Wiza and Sons,Research and Development
659,Ynes,Dickerline,281442515,Female,Youngstown State University,Goodwin, Stamm and Spencer,Business Development
660,Patrizius,Cuniffe,11130,Male,Ahi Evran University,McKenzie, Auer and Lakin,Business Development
661,Marne,Beldom,368150,Female,De Montfort University Leicester,Connelly-Fritsch,Marketing
662,Averil,Pedracci,,Male,RKDF University,Willms-Huels,Training
663,Koenraad,Bernardeschi,463077762,Male,Fachhochschule Gelsenkirchen,Barrows Inc,Marketing
664,Waldon,Korneichuk,33160,Male,Universität Leipzig,Stark, Lueilwitz and Harris,Training
665,Leodora,Stoodale,389015230,Female,Pannnasatra University of Cambodia,McLaughlin Inc,Business Development
666,Denyse,Amor,258015977,Female,Technological Education Institute of Mesologgi,Runte-Herzog,Accounting
667,Rand,Rushforth,521529,Male,Mount Vernon College,Bergnaum, Hilll and Smith,Business Development
668,Korney,Sandbrook,,Female,Hiram College,Johnson-Wisoky,Services
669,Ardene,Oganesian,927801960,Non-binary,Ummah University,Glover, Gusikowski and Raynor,Research and Development
670,Reggi,Warr,762553616,Agender,University of Leeds,O'Connell, Rau and Kuhn,Human Resources
671,Lira,Portriss,543073508,Female,Université de Guelma,Bartell Group,Human Resources
672,Gaile,Coffey,242117664,Male,Universidad José Cecilio del Valle,Bechtelar, Miller and Hirthe,Legal
673,Chelsea,Stickland,714493717,Female,Universitas Muhammadiyah Mataram,Wisozk and Sons,Marketing
674,Mead,Gut,514451699,Female,Jiangxi Normal University,Conn, Tremblay and Baumbach,Product Management
675,Yorke,Overel,774802801,Male,Regent College,Crist LLC,Human Resources
676,Butch,Biggam,982212557,Male,European Business School Schloß Reichartshausen,Fay-Johnson,Support
677,Darrelle,MacArthur,711055714,Female,Universidad para la Cooperación Internacional,Connelly Group,Sales
678,Tulley,Pidgin,614553313,Male,Bowling Green State University,Hintz-Herman,Engineering
679,Marci,Bernardes,482030160,Female,Universidad Galileo,Hand, Bashirian and Jaskolski,Product Management
680,Oliviero,Westmoreland,282604093,Male,Kun Shan University,Koepp, VonRueden and Considine,Product Management
681,Lorena,Yorkston,,Female,European University Cyprus,Macejkovic Group,Business Development
682,Rik,Hebditch,617398998,Male,Indian Institute of Technology, Roorkee,Kessler, Keebler and Cole,Sales
683,Douglass,Birtonshaw,10707,Male,Azerbaijan State Economic University,Fay-Reichert,Human Resources
684,Noella,Mignot,72602,Female,University of Florence,DuBuque Group,Legal
685,Morton,Kittman,364205321,Male,Integral University,Green-Swaniawski,Product Management
686,Terrance,Itzkovwitch,704042668,Male,Instituto Politécnico Nacional,Klocko and Sons,Sales
687,Kanya,Treleven,282115121,Female,Lahore University of Management Sciences,Auer-Kohler,Accounting
688,Wake,Steart,,Male,Planwel University,Medhurst-Pfannerstill,Engineering
689,Lek,Ordelt,296072101,Male,Instituto Politécnico de Coimbra,Senger, Ankunding and Tillman,Research and Development
690,Paige,Cosker,2710-470,Female,University of Illinois at Chicago,Stiedemann, Kassulke and Hane,Services
691,Alidia,Congreave,046523620,Female,Shri Jagannath Sanskrit University,Koepp and Sons,Sales
692,Osmund,Guilaem,3025-377,Male,K.N.Toosi University of Technology,Corwin Group,Accounting
693,Goldia,Steptoe,564821253,Female,British Institute in Paris, University of London,Conroy-Welch,Legal
694,Kevan,Lehrer,760678246,Male,Keisen Jogaku-en College,Sporer, Effertz and McGlynn,Human Resources
695,Bayard,Featherstone,,Male,Nagaland University,Koepp and Sons,Sales
696,Timothy,Lottrington,395330555,Male,Tecnologico de Baja California, Universidad,Miller-Buckridge,Services
697,Joshuah,Sommerlin,551012502,Male,Jomo Kenyatta University of Agriculture and Technology,Skiles Group,Marketing
698,Millie,Oddy,5850,Female,Kyushu University,Dietrich Group,Services
699,Robbyn,Lampe,,Female,Hitotsubashi University,Luettgen-Hyatt,Engineering
700,Thurstan,Kincaid,33168,Male,Laikipia University,Herzog LLC,Services
701,Cornie,Lansberry,475012860,Female,Université de Ouagadougou,Howell, Goodwin and Becker,Services
702,Bridgette,Brolechan,926472656,Female,Penza State University,Dibbert and Sons,Research and Development
703,Robin,Heppenspall,75712 CEDEX 15,Female,Brandman University,Crona LLC,Marketing
704,Addie,Hulse,544495703,Male,International University for Graduate Studies,Toy, Quitzon and Beatty,Research and Development
705,Blinni,Penhaligon,807341854,Female,Long Island University, Southampton College,Kshlerin Group,Accounting
706,Ashil,O'Hannen,331865327,Female,Universidad Nacional Daniel Alcides Carrion,Kerluke LLC,Research and Development
707,Dulce,Palfreeman,331553009,Female,Karaganda State Technical University,Wiegand and Sons,Business Development
708,Madison,Larmett,295269142,Male,Pomona College,Witting-Satterfield,Legal
709,Gunner,Tolworthie,5330,Male,Universitas Pekalongan,Welch Inc,Research and Development
710,Yorke,Yakebovich,460112145,Genderqueer,National Yunlin University of Science and Technology,Grimes-Rogahn,Business Development
711,Giles,Broadbury,331657574,Male,University of Medicine and Pharmacy of Cluj-Napoca,Kassulke-Wolff,Product Management
712,Mercy,Ogden,142672,Female,Universidad Cardenal Herrera-CEU,Koelpin-Witting,Services
713,Alfons,Cardon,L9T,Male,Kerman University of Medical Sciences,Kunze, Baumbach and Morar,Services
714,Nelia,Lorenzini,3309,Female,Karnatak University,Monahan Inc,Sales
715,Nobie,Dumbarton,331553009,Male,East-Siberian State University,Fisher and Sons,Legal
716,Correna,Kennion,911892322,Female,Makanlal Chutur Vedi University,Langosh-Heaney,Training
717,Tome,Pettendrich,94115,Male,Universidad Técnica de Babahoyo,Wilkinson, Collier and Satterfield,Accounting
718,Valida,Silverson,663914,Female,Auckland University of Technology,Murazik-Huels,Accounting
719,Thoma,Jerdan,708084375,Male,University of Saint Joseph,Collins-Ryan,Legal
720,Ingar,Lynagh,236011929,Male,Univesidade Agostinho Neto,Dicki, Stoltenberg and McCullough,Legal
721,Jacky,Lenoir,072023625,Male,West Bengal University of Animal and Fishery Sciences,Lakin and Sons,Training
722,Hortense,Cleaveland,49048,Female,The New School,VonRueden LLC,Product Management
723,Krishnah,Guittet,287440569,Male,Sugino Women's College,Waelchi-Muller,Research and Development
724,Alisha,Coalbran,007372800,Female,Australian Lutheran College,Fadel, Bauch and Ledner,Accounting
725,Seth,Vowells,462292887,Male,Universidad de Medellín,Jakubowski Group,Human Resources
726,Mort,Witherop,265071127,Male,Bila Cerkva State Agrarian University,Wilkinson, Stroman and Kuhic,Engineering
727,Ernst,Sanches,331652076,Male,Aga Khan University,Heller-Feil,Business Development
728,Liza,Cassely,750023024,Female,University of New England,Homenick, Crooks and Welch,Engineering
729,Moises,McKinnell,946081804,Male,Evangelische Fachhochschule Ludwigshafen Hochschule für Sozial- und Gesundheitswesen,Lehner, Dietrich and Effertz,Business Development
730,Merrilee,Bullick,331782775,Female,University College of Gävle,Roob-VonRueden,Sales
731,Viviana,Hairesnape,,Female,Bratislava International School of Liberal Arts,Barrows, Altenwerth and Runte,Business Development
732,Karel,Bondesen,006311003,Agender,National Taipei University of Technology,Haley LLC,Accounting
733,Dimitri,de la Tremoille,,Male,European Academy of Arts in Warsaw,Larkin-Stamm,Business Development
734,Alleen,Trollope,998017808,Female,Intercollege,Schroeder, Ernser and Cormier,Research and Development
735,Anatollo,Barfield,11900-000,Male,Hochschule Anhalt (FH), Hochschule für angewandte Wissenschaften,Emard LLC,Support
736,Kinna,Proschek,6521,Female,Al-Bukhari International University,Welch Inc,Product Management
737,Briny,Garvie,,Female,Institute of Business Management ,Schuster and Sons,Product Management
738,Zorana,Bantock,,Female,Sabaragamuwa University of Sri Lanka,Mante LLC,Legal
739,Dalton,Arndt,921015738,Male,The Boston Conservatory,Bauch-Witting,Services
740,Paten,Hay,752847488,Male,Hogeschool Leiden,Roberts, Murray and Schinner,Legal
741,Wang,Durnell,01915,Genderqueer,Université des Antilles et de la Guyane,Little-Rempel,Engineering
742,Lauren,Fayer,100033801,Male,Ecole Supérieure d'Optique,Dach-Price,Legal
743,Queenie,Haughey,278933428,Genderqueer,Babasaheb Bhimrao Ambedkar University,Nolan, Green and Raynor,Sales
744,Lindsay,McConnel,52349,Male,Piedmont Baptist College,Thompson-Leannon,Product Management
745,Lucas,Shearer,850122702,Male,Florida Gulf Coast University,Corkery Group,Business Development
746,Berta,Cator,484167908,Female,Soai University,Russel-Kub,Engineering
747,Tobe,Eakle,074441647,Male,Shaheed Chamran University,Breitenberg Group,Marketing
748,Tore,Olivari,190273100,Male,Divine Word College of Legazpi,Metz LLC,Product Management
749,Steven,Shrive,,Male,Eastern Oregon University,Sauer-Effertz,Product Management
750,Elisabetta,Kolyagin,6120-215,Female,Wenzhou University,Volkman, Bahringer and Hegmann,Legal
751,Haroun,Reddyhoff,331653747,Male,Texas Lutheran University,Cronin Inc,Sales
752,Elga,Le Moucheux,074502726,Female,Texila American University,Robel-Funk,Training
753,Egan,Lembrick,232271149,Polygender,Volyn National University Lesja Ukrainka,Walsh-O'Connell,Engineering
754,Electra,Forshaw,,Female,Université de Cocody,Spinka-Yundt,Services
755,Stafford,Wrenn,,Male,Lincoln University San Francisco,Kirlin-Dach,Support
756,Trumaine,Antonnikov,215023765,Male,Vladimir State University,Roob-Mills,Engineering
757,Stanislaw,Hawton,531292452,Male,Dhaka International University,Altenwerth-Cummings,Product Management
758,Clarita,Saffe,064603158,Female,Indian Veterinary Research Institute,Dietrich LLC,Human Resources
759,Byrom,Toope,782293550,Male,Franklin Pierce Law Center,Thompson Group,Human Resources
760,Hewe,Morrish,98848,Male,Universitas Muhammadiyah Sumatra Utara,Aufderhar LLC,Accounting
761,Linnet,Wedlock,,Female,E.A.P. Europäische Wirtschaftshochschule Berlin,Padberg, Schaden and Wintheiser,Accounting
762,Berry,Jory,164079121,Female,Universität Fridericana Karlsruhe (Technische Hochschule),Collins-Mosciski,Product Management
763,Dinnie,Duddy,902422804,Female,University of Denver,Hoppe LLC,Research and Development
764,Lancelot,Ambrogi,,Male,Jadavpur University,Hansen, Swaniawski and O'Keefe,Accounting
765,Anson,Oxby,331695710,Male,Midway College,Bradtke-Koepp,Engineering
766,Suki,Drabble,493072048,Female,Agricultural-Technical Academy in Olsztyn,Considine and Sons,Business Development
767,Delano,Staniland,45350-000,Genderfluid,University of Ferrara,Waelchi, DuBuque and Fahey,Training
768,Corabel,Kinver,712204441,Female,Instituto Superior de Línguas e Administração,Kuhlman, Marquardt and Hirthe,Services
769,Ive,Telling,22001,Agender,Massachusetts Maritime Academy,Wiza, Gerlach and Cummerata,Training
770,Linette,Winnett,040113310,Female,Università Bocconi,Renner-Simonis,Product Management
771,Kassandra,Holbie,482772739,Female,Technological University (Mandalay),Hyatt Inc,Sales
772,Darline,Brine,170554325,Female,Universidad Dominico-Americana,Rempel and Sons,Marketing
773,Tawnya,Baldin,48075,Non-binary,Miami University of Ohio,Grady-Kilback,Marketing
774,Aggi,Karlik,,Genderqueer,NTI University,Wilkinson Inc,Accounting
775,Averil,Mahomet,370275079,Male,University Konstantina Filozov in Nitra,Ritchie, D'Amore and Block,Marketing
776,Worden,Batting,,Bigender,University of West Los Angeles,Kshlerin Group,Legal
777,Elias,Milliken,392723004,Male,Mount Vernon College,Kuhn, Cummerata and Macejkovic,Human Resources
778,Helene,Maggill'Andreis,765743564,Female,Bryn Mawr College,Cummerata LLC,Sales
779,Jessica,de Tocqueville,710522603,Female,Volyn National University Lesja Ukrainka,Ebert, Collins and Toy,Marketing
780,Magnum,Arghent,764424462,Male,Universidad Privada Franz Tamayo (UNIFRANZ),Lakin, Funk and Kerluke,Research and Development
781,Sarajane,Karlsen,565732102,Female,Facultés Universitaires Catholiques de Mons,Goldner, Mante and Homenick,Legal
782,Jared,Aleksandrov,501312949,Male,University of the Philippines Open University,Okuneva-Ziemann,Engineering
783,Ezechiel,Paxman,730704006,Genderfluid,Universitas Negeri Padang,Olson, Gorczany and Cummings,Engineering
784,Trevar,Huge,,Male,North Carolina School of the Arts,Jacobs, Bosco and Dare,Accounting
785,Nell,Gleader,111022448,Female,Universitas Ahmad Dahlan,Will LLC,Product Management
786,Merry,Shambroke,,Female,Yaroslavl State Technical University,Glover LLC,Services
787,Fenelia,Vandenhoff,064053009,Genderfluid,St. Andrew's University,Schmidt LLC,Legal
788,Irving,Betser,700062970,Male,Ecole Centrale de Lyon,White and Sons,Support
789,Odella,Hanlon,197025709,Female,Khmelnitsky National University,Morar, Rice and Smitham,Sales
790,Henrietta,Oman,676421435,Female,Mercer University,Dickinson, Greenfelder and Wiegand,Research and Development
791,Denver,Englefield,136199703,Male,Appalachian State University,Emard and Sons,Services
792,Sonya,Robertazzi,84304 CEDEX,Female,Tianjin Academy of Fine Art,Klocko-Waters,Services
793,Joelynn,Alwen,381114744,Female,Karlstad University,Stroman-Grant,Training
794,Bastien,Nicolls,993495116,Polygender,Smolensk Humanitarian University,D'Amore-Gutkowski,Support
795,Randal,Boorne,,Male,Great Lakes Christian College,Stokes-Runolfsdottir,Training
796,Kissiah,Cuckson,648043503,Female,University of Maryland (System),O'Hara LLC,Training
797,Erda,Michelin,788525893,Female,Duke University,Runolfsdottir-Mertz,Business Development
798,Teddie,O'Loughnan,061171508,Male,Don State Agrarian University,Berge Inc,Research and Development
799,Philbert,Cabera,837010640,Polygender,Adventist University of Africa,Crona Inc,Sales
800,Galina,Malden,178222575,Female,Université Libre de Bruxelles,Tromp Inc,Training
801,Allianora,Pentecost,344715159,Female,Universitas Yarsi,Leffler and Sons,Support
